"No.","Time","Delta-time","Source","Destination","Protocol","Length","Info","Source port","Destination port"
"1","0.000000","0.000000","192.168.68.100","255.255.255.255","UDP","207","20000  >  10002 Len=165","20000","10002"
"2","0.997818","0.997818","192.168.68.100","255.255.255.255","UDP","207","20000  >  10002 Len=165","20000","10002"
"3","1.094604","0.096786","192.168.68.121","192.168.1.1","DNS","86","Standard query 0x12c8 A checkappexec.microsoft.com","62094","53"
"4","1.112879","0.018275","192.168.68.121","192.168.68.1","DNS","86","Standard query 0x12c8 A checkappexec.microsoft.com","62094","53"
"5","1.113155","0.000276","192.168.1.1","192.168.68.121","DNS","219","Standard query response 0x12c8 A checkappexec.microsoft.com CNAME prod-atm-wds-apprep.trafficmanager.net CNAME prod-agic-us-2.uksouth.cloudapp.azure.com A 172.165.69.228","53","62094"
"6","1.117051","0.003896","192.168.68.121","172.165.69.228","TCP","66","51282  >  443 [SYN] Seq=0 Win=65535 Len=0 MSS=1460 WS=256 SACK_PERM","51282","443"
"7","1.119771","0.002720","192.168.68.121","192.168.1.1","DNS","85","Standard query 0x5b70 PTR 1.68.168.192.in-addr.arpa","52797","53"
"8","1.133848","0.014077","192.168.68.1","192.168.68.121","DNS","219","Standard query response 0x12c8 A checkappexec.microsoft.com CNAME prod-atm-wds-apprep.trafficmanager.net CNAME prod-agic-us-2.uksouth.cloudapp.azure.com A 172.165.69.228","53","62094"
"9","1.136002","0.002154","172.165.69.228","192.168.68.121","TCP","66","443  >  51282 [SYN, ACK] Seq=0 Ack=1 Win=65535 Len=0 MSS=1400 SACK_PERM WS=4096","443","51282"
"10","1.136065","0.000063","192.168.68.121","172.165.69.228","TCP","54","51282  >  443 [ACK] Seq=1 Ack=1 Win=262144 Len=0","51282","443"
"11","1.138038","0.001973","192.168.68.121","172.165.69.228","TLSv1.2","265","Client Hello (SNI=checkappexec.microsoft.com)","51282","443"
"12","1.139268","0.001230","192.168.1.1","192.168.68.121","DNS","140","Standard query response 0x5b70 No such name PTR 1.68.168.192.in-addr.arpa SOA 168.192.IN-ADDR.ARPA","53","52797"
"13","1.139712","0.000444","192.168.68.121","224.0.0.251","MDNS","91","Standard query 0x0000 PTR 1.68.168.192.in-addr.arpa.local, ""QM"" question","5353","5353"
"14","1.139927","0.000215","fe80::dc4b:6313:da4f:dd3","ff02::fb","MDNS","111","Standard query 0x0000 PTR 1.68.168.192.in-addr.arpa.local, ""QM"" question","5353","5353"
"15","1.140247","0.000320","fe80::dc4b:6313:da4f:dd3","ff02::1:3","LLMNR","105","Standard query 0xf9b5 PTR 1.68.168.192.in-addr.arpa","59773","5355"
"16","1.140409","0.000162","192.168.68.121","224.0.0.252","LLMNR","85","Standard query 0xf9b5 PTR 1.68.168.192.in-addr.arpa","59773","5355"
"17","1.187327","0.046918","172.165.69.228","192.168.68.121","TCP","60","443  >  51282 [ACK] Seq=1 Ack=212 Win=69632 Len=0","443","51282"
"18","1.300958","0.113631","172.165.69.228","192.168.68.121","TLSv1.2","1454","Server Hello","443","51282"
"19","1.300958","0.000000","172.165.69.228","192.168.68.121","TCP","114","443  >  51282 [PSH, ACK] Seq=1401 Ack=212 Win=69632 Len=60 [TCP PDU reassembled in 25]","443","51282"
"20","1.300958","0.000000","172.165.69.228","192.168.68.121","TCP","1454","443  >  51282 [ACK] Seq=1461 Ack=212 Win=69632 Len=1400 [TCP PDU reassembled in 25]","443","51282"
"21","1.300958","0.000000","172.165.69.228","192.168.68.121","TCP","1290","443  >  51282 [PSH, ACK] Seq=2861 Ack=212 Win=69632 Len=1236 [TCP PDU reassembled in 25]","443","51282"
"22","1.301038","0.000080","192.168.68.121","172.165.69.228","TCP","54","51282  >  443 [ACK] Seq=212 Ack=4097 Win=262144 Len=0","51282","443"
"23","1.308474","0.007436","172.165.69.228","192.168.68.121","TCP","1454","443  >  51282 [ACK] Seq=4097 Ack=212 Win=69632 Len=1400 [TCP PDU reassembled in 25]","443","51282"
"24","1.308533","0.000059","192.168.68.121","172.165.69.228","TCP","54","51282  >  443 [ACK] Seq=212 Ack=5497 Win=262144 Len=0","51282","443"
"25","1.340843","0.032310","172.165.69.228","192.168.68.121","TLSv1.2","1454","Certificate","443","51282"
"26","1.340913","0.000070","192.168.68.121","172.165.69.228","TCP","54","51282  >  443 [ACK] Seq=212 Ack=6897 Win=262144 Len=0","51282","443"
"27","1.349625","0.008712","172.165.69.228","192.168.68.121","TLSv1.2","1232","Certificate Status, Server Key Exchange, Server Hello Done","443","51282"
"28","1.349737","0.000112","192.168.68.121","172.165.69.228","TCP","54","51282  >  443 [ACK] Seq=212 Ack=8075 Win=260864 Len=0","51282","443"
"29","1.411039","0.061302","192.168.68.121","192.168.1.1","DNS","85","Standard query 0x9282 A chrome.cloudflare-dns.com","53420","53"
"30","1.411382","0.000343","192.168.68.121","172.165.69.228","TLSv1.2","147","Client Key Exchange, Change Cipher Spec, Encrypted Handshake Message","51282","443"
"31","1.411512","0.000130","192.168.68.121","192.168.1.1","DNS","85","Standard query 0xd357 HTTPS chrome.cloudflare-dns.com","51240","53"
"32","1.438849","0.027337","172.165.69.228","192.168.68.121","TCP","60","443  >  51282 [ACK] Seq=8075 Ack=305 Win=69632 Len=0","443","51282"
"33","1.438849","0.000000","192.168.1.1","192.168.68.121","DNS","117","Standard query response 0x9282 A chrome.cloudflare-dns.com A 162.159.61.3 A 172.64.41.3","53","53420"
"34","1.438849","0.000000","192.168.1.1","192.168.68.121","DNS","158","Standard query response 0xd357 HTTPS chrome.cloudflare-dns.com HTTPS","53","51240"
"35","1.442119","0.003270","192.168.68.121","162.159.61.3","QUIC","1292","Initial, DCID=0a15e7ff9364b216, PKN: 1, CRYPTO, PADDING, PING, CRYPTO, CRYPTO, PADDING, CRYPTO, CRYPTO, PADDING, CRYPTO, PADDING, CRYPTO, CRYPTO, PADDING, CRYPTO, CRYPTO, PADDING, PING","54944","443"
"36","1.442259","0.000140","192.168.68.121","162.159.61.3","QUIC","1292","Initial, DCID=0a15e7ff9364b216, PKN: 2, PADDING, CRYPTO, CRYPTO, PING, CRYPTO, PADDING, CRYPTO, PING, CRYPTO, PADDING, PING, CRYPTO, PADDING, CRYPTO, PADDING, CRYPTO, PADDING","54944","443"
"37","1.442932","0.000673","192.168.68.121","162.159.61.3","TCP","66","51283  >  443 [SYN] Seq=0 Win=64240 Len=0 MSS=1460 WS=256 SACK_PERM","51283","443"
"38","1.443298","0.000366","192.168.68.121","162.159.61.3","TCP","66","51284  >  443 [SYN] Seq=0 Win=64240 Len=0 MSS=1460 WS=256 SACK_PERM","51284","443"
"39","1.456487","0.013189","192.168.68.121","192.168.1.1","DNS","85","Standard query 0xaafb PTR 3.61.159.162.in-addr.arpa","62055","53"
"40","1.474414","0.017927","162.159.61.3","192.168.68.121","TCP","66","443  >  51283 [SYN, ACK] Seq=0 Ack=1 Win=65535 Len=0 MSS=1400 SACK_PERM WS=4096","443","51283"
"41","1.474414","0.000000","162.159.61.3","192.168.68.121","TCP","66","443  >  51284 [SYN, ACK] Seq=0 Ack=1 Win=65535 Len=0 MSS=1400 SACK_PERM WS=4096","443","51284"
"42","1.474554","0.000140","192.168.68.121","162.159.61.3","TCP","54","51283  >  443 [ACK] Seq=1 Ack=1 Win=131584 Len=0","51283","443"
"43","1.474610","0.000056","192.168.68.121","162.159.61.3","TCP","54","51284  >  443 [ACK] Seq=1 Ack=1 Win=131584 Len=0","51284","443"
"44","1.475296","0.000686","192.168.68.121","162.159.61.3","TCP","1454","51283  >  443 [ACK] Seq=1 Ack=1 Win=131584 Len=1400 [TCP PDU reassembled in 45]","51283","443"
"45","1.475296","0.000000","192.168.68.121","162.159.61.3","TLSv1.3","389","Client Hello (SNI=chrome.cloudflare-dns.com)","51283","443"
"46","1.476027","0.000731","192.168.68.121","162.159.61.3","TCP","1454","51284  >  443 [ACK] Seq=1 Ack=1 Win=131584 Len=1400 [TCP PDU reassembled in 47]","51284","443"
"47","1.476027","0.000000","192.168.68.121","162.159.61.3","TLSv1.3","389","Client Hello (SNI=chrome.cloudflare-dns.com)","51284","443"
"48","1.483846","0.007819","192.168.1.1","192.168.68.121","DNS","147","Standard query response 0xaafb No such name PTR 3.61.159.162.in-addr.arpa SOA cruz.ns.cloudflare.com","53","62055"
"49","1.484817","0.000971","192.168.68.121","224.0.0.251","MDNS","91","Standard query 0x0000 PTR 3.61.159.162.in-addr.arpa.local, ""QM"" question","5353","5353"
"50","1.485882","0.001065","fe80::dc4b:6313:da4f:dd3","ff02::fb","MDNS","111","Standard query 0x0000 PTR 3.61.159.162.in-addr.arpa.local, ""QM"" question","5353","5353"
"51","1.486955","0.001073","192.168.68.121","224.0.0.251","MDNS","91","Standard query 0x0000 PTR 3.61.159.162.in-addr.arpa.local, ""QM"" question","5353","5353"
"52","1.487456","0.000501","fe80::dc4b:6313:da4f:dd3","ff02::fb","MDNS","111","Standard query 0x0000 PTR 3.61.159.162.in-addr.arpa.local, ""QM"" question","5353","5353"
"53","1.499396","0.011940","172.165.69.228","192.168.68.121","TLSv1.2","344","New Session Ticket, Change Cipher Spec, Encrypted Handshake Message","443","51282"
"54","1.499396","0.000000","172.165.69.228","192.168.68.121","TLSv1.2","123","Application Data","443","51282"
"55","1.499396","0.000000","162.159.61.3","192.168.68.121","TCP","60","443  >  51283 [ACK] Seq=1 Ack=1401 Win=69632 Len=0","443","51283"
"56","1.499396","0.000000","162.159.61.3","192.168.68.121","TCP","60","443  >  51283 [ACK] Seq=1 Ack=1736 Win=73728 Len=0","443","51283"
"57","1.499594","0.000198","192.168.68.121","172.165.69.228","TCP","54","51282  >  443 [ACK] Seq=305 Ack=8434 Win=262144 Len=0","51282","443"
"58","1.502085","0.002491","192.168.68.121","172.165.69.228","TLSv1.2","141","Application Data","51282","443"
"59","1.502229","0.000144","192.168.68.121","172.165.69.228","TLSv1.2","92","Application Data","51282","443"
"60","1.505063","0.002834","192.168.68.121","172.165.69.228","TLSv1.2","320","Application Data","51282","443"
"61","1.505367","0.000304","192.168.68.121","172.165.69.228","TCP","1454","51282  >  443 [ACK] Seq=696 Ack=8434 Win=262144 Len=1400 [TCP PDU reassembled in 62]","51282","443"
"62","1.505367","0.000000","192.168.68.121","172.165.69.228","TLSv1.2","163","Application Data","51282","443"
"63","1.505524","0.000157","192.168.68.121","172.165.69.228","TLSv1.2","92","Application Data","51282","443"
"64","1.510691","0.005167","162.159.61.3","192.168.68.121","TCP","60","443  >  51284 [ACK] Seq=1 Ack=1401 Win=69632 Len=0","443","51284"
"65","1.510691","0.000000","162.159.61.3","192.168.68.121","TCP","60","443  >  51284 [ACK] Seq=1 Ack=1736 Win=73728 Len=0","443","51284"
"66","1.530217","0.019526","172.165.69.228","192.168.68.121","TCP","60","443  >  51282 [ACK] Seq=8434 Ack=392 Win=69632 Len=0","443","51282"
"67","1.530217","0.000000","172.165.69.228","192.168.68.121","TCP","60","443  >  51282 [ACK] Seq=8434 Ack=430 Win=69632 Len=0","443","51282"
"68","1.530217","0.000000","172.165.69.228","192.168.68.121","TCP","60","443  >  51282 [ACK] Seq=8434 Ack=696 Win=69632 Len=0","443","51282"
"69","1.530217","0.000000","172.165.69.228","192.168.68.121","TCP","60","443  >  51282 [ACK] Seq=8434 Ack=2096 Win=73728 Len=0","443","51282"
"70","1.530680","0.000463","172.165.69.228","192.168.68.121","TCP","60","443  >  51282 [ACK] Seq=8434 Ack=2205 Win=73728 Len=0","443","51282"
"71","1.530680","0.000000","172.165.69.228","192.168.68.121","TCP","60","443  >  51282 [ACK] Seq=8434 Ack=2243 Win=73728 Len=0","443","51282"
"72","1.539247","0.008567","fe80::dc4b:6313:da4f:dd3","ff02::1:3","LLMNR","105","Standard query 0xf9b5 PTR 1.68.168.192.in-addr.arpa","59773","5355"
"73","1.539418","0.000171","192.168.68.121","224.0.0.252","LLMNR","85","Standard query 0xf9b5 PTR 1.68.168.192.in-addr.arpa","59773","5355"
"74","1.589540","0.050122","192.168.68.121","192.168.1.1","DNS","85","Standard query 0x737c PTR 3.61.159.162.in-addr.arpa","56372","53"
"75","1.592948","0.003408","172.165.69.228","192.168.68.121","TLSv1.2","92","Application Data","443","51282"
"76","1.592994","0.000046","192.168.68.121","172.165.69.228","TCP","54","51282  >  443 [ACK] Seq=2243 Ack=8472 Win=261888 Len=0","51282","443"
"77","1.602238","0.009244","172.165.69.228","192.168.68.121","TLSv1.2","96","Application Data","443","51282"
"78","1.602291","0.000053","192.168.68.121","172.165.69.228","TCP","54","51282  >  443 [ACK] Seq=2243 Ack=8514 Win=261888 Len=0","51282","443"
"79","1.608255","0.005964","192.168.1.1","192.168.68.121","DNS","147","Standard query response 0x737c No such name PTR 3.61.159.162.in-addr.arpa SOA cruz.ns.cloudflare.com","53","56372"
"80","1.608757","0.000502","192.168.68.121","224.0.0.251","MDNS","91","Standard query 0x0000 PTR 3.61.159.162.in-addr.arpa.local, ""QM"" question","5353","5353"
"81","1.609023","0.000266","fe80::dc4b:6313:da4f:dd3","ff02::fb","MDNS","111","Standard query 0x0000 PTR 3.61.159.162.in-addr.arpa.local, ""QM"" question","5353","5353"
"82","1.662886","0.053863","172.165.69.228","192.168.68.121","TLSv1.2","425","Application Data","443","51282"
"83","1.662952","0.000066","192.168.68.121","172.165.69.228","TCP","54","51282  >  443 [ACK] Seq=2243 Ack=8885 Win=261632 Len=0","51282","443"
"84","1.756904","0.093952","192.168.68.121","162.159.61.3","QUIC","1292","Initial, DCID=0a15e7ff9364b216, PKN: 4, CRYPTO, CRYPTO, PADDING, CRYPTO, CRYPTO, PING, CRYPTO, PADDING, PING, PING, CRYPTO, PING, CRYPTO, CRYPTO, PADDING, CRYPTO, PADDING, CRYPTO, PING","54944","443"
"85","1.889774","0.132870","162.159.61.3","192.168.68.121","TLSv1.3","1454","Server Hello, Change Cipher Spec","443","51283"
"86","1.889774","0.000000","162.159.61.3","192.168.68.121","TCP","1454","443  >  51283 [PSH, ACK] Seq=1401 Ack=1736 Win=73728 Len=1400 [TCP PDU reassembled in 87]","443","51283"
"87","1.889774","0.000000","162.159.61.3","192.168.68.121","TLSv1.3","1028","Encrypted Extensions, Compressed Certificate, Certificate Verify, Finished","443","51283"
"88","1.889851","0.000077","192.168.68.121","162.159.61.3","TCP","54","51283  >  443 [ACK] Seq=1736 Ack=3775 Win=131584 Len=0","51283","443"
"89","1.894672","0.004821","162.159.61.3","192.168.68.121","TLSv1.3","1454","Server Hello, Change Cipher Spec","443","51284"
"90","1.894672","0.000000","162.159.61.3","192.168.68.121","TCP","1454","443  >  51284 [PSH, ACK] Seq=1401 Ack=1736 Win=73728 Len=1400 [TCP PDU reassembled in 91]","443","51284"
"91","1.894672","0.000000","162.159.61.3","192.168.68.121","TLSv1.3","1027","Encrypted Extensions, Compressed Certificate, Certificate Verify, Finished","443","51284"
"92","1.894730","0.000058","192.168.68.121","162.159.61.3","TCP","54","51284  >  443 [ACK] Seq=1736 Ack=3774 Win=131584 Len=0","51284","443"
"93","1.895066","0.000336","192.168.68.121","162.159.61.3","TLSv1.3","118","Change Cipher Spec, Finished","51283","443"
"94","1.895705","0.000639","192.168.68.121","162.159.61.3","TLSv1.3","118","Change Cipher Spec, Finished","51284","443"
"95","1.895884","0.000179","192.168.68.121","162.159.61.3","TCP","54","51284  >  443 [FIN, ACK] Seq=1800 Ack=3774 Win=131584 Len=0","51284","443"
"96","1.895994","0.000110","192.168.68.121","162.159.61.3","HTTP2","146","Magic, SETTINGS[0], WINDOW_UPDATE[0]","51283","443"
"97","1.896260","0.000266","192.168.68.121","162.159.61.3","HTTP2","194","HEADERS[1]: POST /dns-query","51283","443"
"98","1.896321","0.000061","192.168.68.121","162.159.61.3","HTTP2","110","HEADERS[3]: POST /dns-query","51283","443"
"99","1.896356","0.000035","192.168.68.121","162.159.61.3","DoH","213","Standard query 0x0000 A clientservices.googleapis.com OPT","51283","443"
"100","1.896417","0.000061","192.168.68.121","162.159.61.3","DoH","213","Standard query 0x0000 HTTPS clientservices.googleapis.com OPT","51283","443"
"101","1.914252","0.017835","162.159.61.3","192.168.68.121","TCP","60","443  >  51283 [ACK] Seq=3775 Ack=1800 Win=73728 Len=0","443","51283"
"102","1.914252","0.000000","162.159.61.3","192.168.68.121","TCP","54","443  >  51284 [ACK] Seq=3774 Ack=1800 Win=73728 Len=0","443","51284"
"103","1.914252","0.000000","162.159.61.3","192.168.68.121","TCP","54","443  >  51284 [FIN, ACK] Seq=3774 Ack=1801 Win=73728 Len=0","443","51284"
"104","1.914313","0.000061","192.168.68.121","162.159.61.3","TCP","54","51284  >  443 [ACK] Seq=1801 Ack=3775 Win=131584 Len=0","51284","443"
"105","1.917028","0.002715","162.159.61.3","192.168.68.121","TCP","60","443  >  51283 [ACK] Seq=3775 Ack=1892 Win=73728 Len=0","443","51283"
"106","1.917028","0.000000","162.159.61.3","192.168.68.121","HTTP2","582","SETTINGS[0], WINDOW_UPDATE[0]","443","51283"
"107","1.917028","0.000000","162.159.61.3","192.168.68.121","TCP","60","443  >  51283 [ACK] Seq=4303 Ack=2032 Win=77824 Len=0","443","51283"
"108","1.917028","0.000000","162.159.61.3","192.168.68.121","TCP","60","443  >  51283 [ACK] Seq=4303 Ack=2088 Win=77824 Len=0","443","51283"
"109","1.917359","0.000331","192.168.68.121","162.159.61.3","HTTP2","85","SETTINGS[0]","51283","443"
"110","1.917415","0.000056","162.159.61.3","192.168.68.121","TCP","60","443  >  51283 [ACK] Seq=4303 Ack=2247 Win=77824 Len=0","443","51283"
"111","1.917415","0.000000","162.159.61.3","192.168.68.121","HTTP2","85","SETTINGS[0]","443","51283"
"112","1.917415","0.000000","162.159.61.3","192.168.68.121","TCP","60","443  >  51283 [ACK] Seq=4334 Ack=2406 Win=81920 Len=0","443","51283"
"113","1.919982","0.002567","162.159.61.3","192.168.68.121","HTTP2","89","WINDOW_UPDATE[3]","443","51283"
"114","1.920024","0.000042","192.168.68.121","162.159.61.3","TCP","54","51283  >  443 [ACK] Seq=2437 Ack=4369 Win=130816 Len=0","51283","443"
"115","1.923790","0.003766","162.159.61.3","192.168.68.121","DoH","694","Standard query response 0x0000 A clientservices.googleapis.com A 142.250.75.131 OPT","443","51283"
"116","1.923790","0.000000","162.159.61.3","192.168.68.121","DoH","609","Standard query response 0x0000 HTTPS clientservices.googleapis.com SOA ns1.google.com OPT","443","51283"
"117","1.923834","0.000044","192.168.68.121","162.159.61.3","TCP","54","51283  >  443 [ACK] Seq=2437 Ack=5564 Win=131584 Len=0","51283","443"
"118","1.924759","0.000925","192.168.68.121","142.250.75.131","TCP","66","51285  >  443 [SYN] Seq=0 Win=64240 Len=0 MSS=1460 WS=256 SACK_PERM","51285","443"
"119","1.934352","0.009593","162.159.61.3","192.168.68.121","TCP","60","443  >  51283 [ACK] Seq=5564 Ack=2437 Win=81920 Len=0","443","51283"
"120","1.944891","0.010539","142.250.75.131","192.168.68.121","TCP","66","443  >  51285 [SYN, ACK] Seq=0 Ack=1 Win=65535 Len=0 MSS=1400 SACK_PERM WS=4096","443","51285"
"121","1.944967","0.000076","192.168.68.121","142.250.75.131","TCP","54","51285  >  443 [ACK] Seq=1 Ack=1 Win=131584 Len=0","51285","443"
"122","1.945431","0.000464","192.168.68.121","142.250.75.131","TCP","1454","51285  >  443 [ACK] Seq=1 Ack=1 Win=131584 Len=1400 [TCP PDU reassembled in 123]","51285","443"
"123","1.945431","0.000000","192.168.68.121","142.250.75.131","TLSv1.3","425","Client Hello (SNI=clientservices.googleapis.com)","51285","443"
"124","1.965751","0.020320","142.250.75.131","192.168.68.121","TCP","60","443  >  51285 [ACK] Seq=1 Ack=1401 Win=69632 Len=0","443","51285"
"125","1.972048","0.006297","142.250.75.131","192.168.68.121","TCP","60","443  >  51285 [ACK] Seq=1 Ack=1772 Win=73728 Len=0","443","51285"
"126","2.023662","0.051614","142.250.75.131","192.168.68.121","TLSv1.3","1454","Server Hello, Change Cipher Spec","443","51285"
"127","2.023662","0.000000","142.250.75.131","192.168.68.121","TCP","1454","443  >  51285 [PSH, ACK] Seq=1401 Ack=1772 Win=73728 Len=1400 [TCP PDU reassembled in 131]","443","51285"
"128","2.023662","0.000000","142.250.75.131","192.168.68.121","TCP","1454","443  >  51285 [ACK] Seq=2801 Ack=1772 Win=73728 Len=1400 [TCP PDU reassembled in 131]","443","51285"
"129","2.023662","0.000000","142.250.75.131","192.168.68.121","TCP","1454","443  >  51285 [PSH, ACK] Seq=4201 Ack=1772 Win=73728 Len=1400 [TCP PDU reassembled in 131]","443","51285"
"130","2.023737","0.000075","192.168.68.121","142.250.75.131","TCP","54","51285  >  443 [ACK] Seq=1772 Ack=5601 Win=131584 Len=0","51285","443"
"131","2.034550","0.010813","142.250.75.131","192.168.68.121","TLSv1.3","213","Encrypted Extensions, Certificate, Certificate Verify, Finished","443","51285"
"132","2.035988","0.001438","192.168.68.121","142.250.75.131","TLSv1.3","128","Change Cipher Spec, Encrypted Extensions, Finished","51285","443"
"133","2.036219","0.000231","192.168.68.121","142.250.75.131","HTTP2","146","Magic, SETTINGS[0], WINDOW_UPDATE[0]","51285","443"
"134","2.036369","0.000150","192.168.68.121","142.250.75.131","HTTP2","425","HEADERS[1]: GET /chrome-variations/seed?osname=win&channel=stable&milestone=133","51285","443"
"135","2.052596","0.016227","142.250.75.131","192.168.68.121","TCP","60","443  >  51285 [ACK] Seq=5760 Ack=1846 Win=73728 Len=0","443","51285"
"136","2.055463","0.002867","142.250.75.131","192.168.68.121","TCP","60","443  >  51285 [ACK] Seq=5760 Ack=1938 Win=73728 Len=0","443","51285"
"137","2.055463","0.000000","142.250.75.131","192.168.68.121","TCP","60","443  >  51285 [ACK] Seq=5760 Ack=2309 Win=77824 Len=0","443","51285"
"138","2.066270","0.010807","142.250.75.131","192.168.68.121","HTTP2","1073","SETTINGS[0]","443","51285"
"139","2.066671","0.000401","192.168.68.121","142.250.75.131","HTTP2","85","SETTINGS[0]","51285","443"
"140","2.084220","0.017549","142.250.75.131","192.168.68.121","TCP","60","443  >  51285 [ACK] Seq=6779 Ack=2340 Win=77824 Len=0","443","51285"
"141","2.137385","0.053165","142.250.75.131","192.168.68.121","HTTP2","557","PING[0]","443","51285"
"142","2.138239","0.000854","192.168.68.121","142.250.75.131","HTTP2","93","PING[0]","51285","443"
"143","2.142841","0.004602","192.168.68.121","224.0.0.251","MDNS","91","Standard query 0x0000 PTR 1.68.168.192.in-addr.arpa.local, ""QM"" question","5353","5353"
"144","2.143087","0.000246","fe80::dc4b:6313:da4f:dd3","ff02::fb","MDNS","111","Standard query 0x0000 PTR 1.68.168.192.in-addr.arpa.local, ""QM"" question","5353","5353"
"145","2.143629","0.000542","192.168.68.121","192.168.1.1","DNS","85","Standard query 0xffc4 PTR 3.61.159.162.in-addr.arpa","63219","53"
"146","2.150742","0.007113","192.168.68.121","142.250.75.131","TCP","54","51285  >  443 [FIN, ACK] Seq=2379 Ack=7282 Win=131584 Len=0","51285","443"
"147","2.150922","0.000180","192.168.68.121","162.159.61.3","TCP","54","51283  >  443 [FIN, ACK] Seq=2437 Ack=5564 Win=131584 Len=0","51283","443"
"148","2.166610","0.015688","142.250.75.131","192.168.68.121","TCP","60","443  >  51285 [ACK] Seq=7282 Ack=2379 Win=77824 Len=0","443","51285"
"149","2.169845","0.003235","192.168.1.1","192.168.68.121","DNS","147","Standard query response 0xffc4 No such name PTR 3.61.159.162.in-addr.arpa SOA cruz.ns.cloudflare.com","53","63219"
"150","2.170285","0.000440","192.168.68.121","224.0.0.251","MDNS","91","Standard query 0x0000 PTR 3.61.159.162.in-addr.arpa.local, ""QM"" question","5353","5353"
"151","2.170533","0.000248","fe80::dc4b:6313:da4f:dd3","ff02::fb","MDNS","111","Standard query 0x0000 PTR 3.61.159.162.in-addr.arpa.local, ""QM"" question","5353","5353"
"152","2.175892","0.005359","162.159.61.3","192.168.68.121","TCP","54","443  >  51283 [FIN, ACK] Seq=5564 Ack=2438 Win=81920 Len=0","443","51283"
"153","2.175892","0.000000","142.250.75.131","192.168.68.121","TCP","54","443  >  51285 [FIN, ACK] Seq=7282 Ack=2380 Win=77824 Len=0","443","51285"
"154","2.175942","0.000050","192.168.68.121","162.159.61.3","TCP","54","51283  >  443 [ACK] Seq=2438 Ack=5565 Win=131584 Len=0","51283","443"
"155","2.175980","0.000038","192.168.68.121","142.250.75.131","TCP","54","51285  >  443 [ACK] Seq=2380 Ack=7283 Win=131584 Len=0","51285","443"
"156","2.365755","0.189775","192.168.68.121","162.159.61.3","QUIC","1292","Initial, DCID=0a15e7ff9364b216, PKN: 6, PING, CRYPTO, PING, PADDING, PING, CRYPTO, CRYPTO, PING, PING, CRYPTO, CRYPTO, PADDING, CRYPTO, PING, CRYPTO, PADDING, CRYPTO, PING, PING, PADDING, CRYPTO","54944","443"
"157","2.489667","0.123912","192.168.68.121","224.0.0.251","MDNS","91","Standard query 0x0000 PTR 3.61.159.162.in-addr.arpa.local, ""QM"" question","5353","5353"
"158","2.489961","0.000294","fe80::dc4b:6313:da4f:dd3","ff02::fb","MDNS","111","Standard query 0x0000 PTR 3.61.159.162.in-addr.arpa.local, ""QM"" question","5353","5353"
"159","2.490321","0.000360","192.168.68.121","224.0.0.251","MDNS","91","Standard query 0x0000 PTR 3.61.159.162.in-addr.arpa.local, ""QM"" question","5353","5353"
"160","2.490602","0.000281","fe80::dc4b:6313:da4f:dd3","ff02::fb","MDNS","111","Standard query 0x0000 PTR 3.61.159.162.in-addr.arpa.local, ""QM"" question","5353","5353"
"161","2.491290","0.000688","192.168.68.121","192.168.1.1","DNS","85","Standard query 0xa180 PTR 3.61.159.162.in-addr.arpa","60042","53"
"162","2.527971","0.036681","192.168.1.1","192.168.68.121","DNS","147","Standard query response 0xa180 No such name PTR 3.61.159.162.in-addr.arpa SOA cruz.ns.cloudflare.com","53","60042"
"163","2.528544","0.000573","192.168.68.121","224.0.0.251","MDNS","91","Standard query 0x0000 PTR 3.61.159.162.in-addr.arpa.local, ""QM"" question","5353","5353"
"164","2.528834","0.000290","fe80::dc4b:6313:da4f:dd3","ff02::fb","MDNS","111","Standard query 0x0000 PTR 3.61.159.162.in-addr.arpa.local, ""QM"" question","5353","5353"
"165","2.615565","0.086731","192.168.68.121","224.0.0.251","MDNS","91","Standard query 0x0000 PTR 3.61.159.162.in-addr.arpa.local, ""QM"" question","5353","5353"
"166","2.615885","0.000320","fe80::dc4b:6313:da4f:dd3","ff02::fb","MDNS","111","Standard query 0x0000 PTR 3.61.159.162.in-addr.arpa.local, ""QM"" question","5353","5353"
"167","3.000990","0.385105","192.168.68.100","255.255.255.255","UDP","207","20000  >  10002 Len=165","20000","10002"
"168","3.140400","0.139410","192.168.68.121","192.168.1.1","DNS","85","Standard query 0xe375 A chrome.cloudflare-dns.com","56580","53"
"169","3.141131","0.000731","192.168.68.121","192.168.1.1","DNS","85","Standard query 0xf382 HTTPS chrome.cloudflare-dns.com","60453","53"
"170","3.164440","0.023309","192.168.68.121","224.0.0.251","MDNS","91","Standard query 0x0000 PTR 3.61.159.162.in-addr.arpa.local, ""QM"" question","5353","5353"
"171","3.165016","0.000576","fe80::dc4b:6313:da4f:dd3","ff02::fb","MDNS","111","Standard query 0x0000 PTR 3.61.159.162.in-addr.arpa.local, ""QM"" question","5353","5353"
"172","3.260933","0.095917","192.168.1.1","192.168.68.121","DNS","117","Standard query response 0xe375 A chrome.cloudflare-dns.com A 162.159.61.3 A 172.64.41.3","53","56580"
"173","3.260933","0.000000","192.168.1.1","192.168.68.121","DNS","158","Standard query response 0xf382 HTTPS chrome.cloudflare-dns.com HTTPS","53","60453"
"174","3.262221","0.001288","192.168.68.121","162.159.61.3","QUIC","1292","Initial, DCID=e19ab9f83dc83533, PKN: 1, PADDING, CRYPTO, CRYPTO, CRYPTO, CRYPTO, CRYPTO, PADDING, CRYPTO, PADDING, CRYPTO, PING, PADDING, CRYPTO, CRYPTO, CRYPTO, PING","60287","443"
"175","3.262348","0.000127","192.168.68.121","162.159.61.3","QUIC","1292","Initial, DCID=e19ab9f83dc83533, PKN: 2, CRYPTO, PING, PADDING, PING, PING, CRYPTO, PADDING, CRYPTO, PADDING, CRYPTO, PADDING, PING, CRYPTO, PADDING","60287","443"
"176","3.262754","0.000406","192.168.68.121","162.159.61.3","TCP","66","51286  >  443 [SYN] Seq=0 Win=64240 Len=0 MSS=1460 WS=256 SACK_PERM","51286","443"
"177","3.263154","0.000400","192.168.68.121","162.159.61.3","TCP","66","51287  >  443 [SYN] Seq=0 Win=64240 Len=0 MSS=1460 WS=256 SACK_PERM","51287","443"
"178","3.263519","0.000365","192.168.68.121","162.159.61.3","TCP","66","51288  >  443 [SYN] Seq=0 Win=64240 Len=0 MSS=1460 WS=256 SACK_PERM","51288","443"
"179","3.263923","0.000404","192.168.68.121","162.159.61.3","TCP","66","51289  >  443 [SYN] Seq=0 Win=64240 Len=0 MSS=1460 WS=256 SACK_PERM","51289","443"
"180","3.291688","0.027765","162.159.61.3","192.168.68.121","TCP","66","443  >  51286 [SYN, ACK] Seq=0 Ack=1 Win=65535 Len=0 MSS=1400 SACK_PERM WS=4096","443","51286"
"181","3.291776","0.000088","192.168.68.121","162.159.61.3","TCP","54","51286  >  443 [ACK] Seq=1 Ack=1 Win=131584 Len=0","51286","443"
"182","3.293284","0.001508","192.168.68.121","162.159.61.3","TCP","1454","51286  >  443 [ACK] Seq=1 Ack=1 Win=131584 Len=1400 [TCP PDU reassembled in 183]","51286","443"
"183","3.293284","0.000000","192.168.68.121","162.159.61.3","TLSv1.3","453","Client Hello (SNI=chrome.cloudflare-dns.com)","51286","443"
"184","3.295967","0.002683","162.159.61.3","192.168.68.121","TCP","66","443  >  51287 [SYN, ACK] Seq=0 Ack=1 Win=65535 Len=0 MSS=1400 SACK_PERM WS=4096","443","51287"
"185","3.295967","0.000000","162.159.61.3","192.168.68.121","TCP","66","443  >  51288 [SYN, ACK] Seq=0 Ack=1 Win=65535 Len=0 MSS=1400 SACK_PERM WS=4096","443","51288"
"186","3.295967","0.000000","162.159.61.3","192.168.68.121","TCP","66","443  >  51289 [SYN, ACK] Seq=0 Ack=1 Win=65535 Len=0 MSS=1400 SACK_PERM WS=4096","443","51289"
"187","3.296097","0.000130","192.168.68.121","162.159.61.3","TCP","54","51287  >  443 [ACK] Seq=1 Ack=1 Win=131584 Len=0","51287","443"
"188","3.296137","0.000040","192.168.68.121","162.159.61.3","TCP","54","51288  >  443 [ACK] Seq=1 Ack=1 Win=131584 Len=0","51288","443"
"189","3.296153","0.000016","192.168.68.121","162.159.61.3","TCP","54","51289  >  443 [ACK] Seq=1 Ack=1 Win=131584 Len=0","51289","443"
"190","3.296609","0.000456","192.168.68.121","162.159.61.3","TCP","1454","51287  >  443 [ACK] Seq=1 Ack=1 Win=131584 Len=1400 [TCP PDU reassembled in 191]","51287","443"
"191","3.296609","0.000000","192.168.68.121","162.159.61.3","TLSv1.3","485","Client Hello (SNI=chrome.cloudflare-dns.com)","51287","443"
"192","3.297110","0.000501","192.168.68.121","162.159.61.3","TCP","1454","51288  >  443 [ACK] Seq=1 Ack=1 Win=131584 Len=1400 [TCP PDU reassembled in 193]","51288","443"
"193","3.297110","0.000000","192.168.68.121","162.159.61.3","TLSv1.3","453","Client Hello (SNI=chrome.cloudflare-dns.com)","51288","443"
"194","3.297648","0.000538","192.168.68.121","162.159.61.3","TCP","1454","51289  >  443 [ACK] Seq=1 Ack=1 Win=131584 Len=1400 [TCP PDU reassembled in 195]","51289","443"
"195","3.297648","0.000000","192.168.68.121","162.159.61.3","TLSv1.2","453","Client Hello (SNI=chrome.cloudflare-dns.com)","51289","443"
"196","3.325910","0.028262","162.159.61.3","192.168.68.121","TCP","60","443  >  51286 [ACK] Seq=1 Ack=1401 Win=69632 Len=0","443","51286"
"197","3.338985","0.013075","162.159.61.3","192.168.68.121","TCP","60","443  >  51286 [ACK] Seq=1 Ack=1800 Win=73728 Len=0","443","51286"
"198","3.338985","0.000000","162.159.61.3","192.168.68.121","TLSv1.3","1454","Server Hello, Change Cipher Spec","443","51286"
"199","3.338985","0.000000","162.159.61.3","192.168.68.121","TCP","114","443  >  51286 [PSH, ACK] Seq=1401 Ack=1800 Win=73728 Len=60 [TCP PDU reassembled in 201]","443","51286"
"200","3.338985","0.000000","162.159.61.3","192.168.68.121","TCP","1454","443  >  51286 [ACK] Seq=1461 Ack=1800 Win=73728 Len=1400 [TCP PDU reassembled in 201]","443","51286"
"201","3.338985","0.000000","162.159.61.3","192.168.68.121","TLSv1.3","968","Encrypted Extensions, Compressed Certificate, Certificate Verify, Finished","443","51286"
"202","3.339083","0.000098","192.168.68.121","162.159.61.3","TCP","54","51286  >  443 [ACK] Seq=1800 Ack=3775 Win=131584 Len=0","51286","443"
"203","3.345387","0.006304","192.168.68.121","162.159.61.3","TLSv1.3","118","Change Cipher Spec, Finished","51286","443"
"204","3.345588","0.000201","192.168.68.121","162.159.61.3","HTTP2","146","Magic, SETTINGS[0], WINDOW_UPDATE[0]","51286","443"
"205","3.345661","0.000073","192.168.68.121","162.159.61.3","TCP","54","51287  >  443 [FIN, ACK] Seq=1832 Ack=1 Win=131584 Len=0","51287","443"
"206","3.345769","0.000108","192.168.68.121","162.159.61.3","TCP","54","51288  >  443 [FIN, ACK] Seq=1800 Ack=1 Win=131584 Len=0","51288","443"
"207","3.345865","0.000096","192.168.68.121","162.159.61.3","TCP","54","51289  >  443 [FIN, ACK] Seq=1800 Ack=1 Win=131584 Len=0","51289","443"
"208","3.346144","0.000279","192.168.68.121","162.159.61.3","HTTP2","194","HEADERS[1]: POST /dns-query","51286","443"
"209","3.346236","0.000092","192.168.68.121","162.159.61.3","HTTP2","110","HEADERS[3]: POST /dns-query","51286","443"
"210","3.346296","0.000060","192.168.68.121","162.159.61.3","HTTP2","110","HEADERS[5]: POST /dns-query","51286","443"
"211","3.346355","0.000059","192.168.68.121","162.159.61.3","HTTP2","110","HEADERS[7]: POST /dns-query","51286","443"
"212","3.346406","0.000051","192.168.68.121","162.159.61.3","DoH","213","Standard query 0x0000 A accounts.google.com OPT","51286","443"
"213","3.346469","0.000063","192.168.68.121","162.159.61.3","DoH","213","Standard query 0x0000 HTTPS accounts.google.com OPT","51286","443"
"214","3.346527","0.000058","192.168.68.121","162.159.61.3","DoH","213","Standard query 0x0000 HTTPS www.google.com OPT","51286","443"
"215","3.346587","0.000060","192.168.68.121","162.159.61.3","DoH","213","Standard query 0x0000 A www.google.com OPT","51286","443"
"216","3.348027","0.001440","162.159.61.3","192.168.68.121","TCP","60","443  >  51287 [ACK] Seq=1 Ack=1401 Win=69632 Len=0","443","51287"
"217","3.350896","0.002869","162.159.61.3","192.168.68.121","TCP","60","443  >  51287 [ACK] Seq=1 Ack=1832 Win=73728 Len=0","443","51287"
"218","3.364865","0.013969","162.159.61.3","192.168.68.121","TCP","54","443  >  51288 [ACK] Seq=1 Ack=1401 Win=69632 Len=0","443","51288"
"219","3.364865","0.000000","162.159.61.3","192.168.68.121","TCP","54","443  >  51288 [ACK] Seq=1 Ack=1800 Win=73728 Len=0","443","51288"
"220","3.364865","0.000000","162.159.61.3","192.168.68.121","TLSv1.3","1454","Server Hello, Change Cipher Spec","443","51288"
"221","3.364959","0.000094","192.168.68.121","162.159.61.3","TCP","54","51288  >  443 [RST, ACK] Seq=1801 Ack=1401 Win=0 Len=0","51288","443"
"222","3.368504","0.003545","192.168.68.121","162.159.61.3","TCP","1454","[TCP Retransmission] 51289  >  443 [FIN, PSH, ACK] Seq=400 Ack=1 Win=131584 Len=1400 [TCP PDU reassembled in 195]","51289","443"
"223","3.378752","0.010248","162.159.61.3","192.168.68.121","TCP","1454","443  >  51288 [PSH, ACK] Seq=1401 Ack=1800 Win=73728 Len=1400 [TCP PDU reassembled in 224]","443","51288"
"224","3.378752","0.000000","162.159.61.3","192.168.68.121","TLSv1.3","1027","Application Data","443","51288"
"225","3.378752","0.000000","162.159.61.3","192.168.68.121","TCP","54","443  >  51289 [ACK] Seq=1 Ack=1401 Win=69632 Len=0","443","51289"
"226","3.378752","0.000000","162.159.61.3","192.168.68.121","TCP","54","443  >  51289 [ACK] Seq=1 Ack=1800 Win=73728 Len=0","443","51289"
"227","3.379418","0.000666","162.159.61.3","192.168.68.121","TCP","60","443  >  51286 [ACK] Seq=3775 Ack=1864 Win=73728 Len=0","443","51286"
"228","3.379928","0.000510","162.159.61.3","192.168.68.121","TCP","54","443  >  51288 [FIN, ACK] Seq=3774 Ack=1801 Win=73728 Len=0","443","51288"
"229","3.379928","0.000000","162.159.61.3","192.168.68.121","TCP","60","443  >  51286 [ACK] Seq=3775 Ack=1956 Win=73728 Len=0","443","51286"
"230","3.379928","0.000000","162.159.61.3","192.168.68.121","TCP","54","443  >  51289 [FIN, ACK] Seq=1 Ack=1801 Win=73728 Len=0","443","51289"
"231","3.379928","0.000000","162.159.61.3","192.168.68.121","TCP","60","443  >  51286 [ACK] Seq=3775 Ack=2096 Win=77824 Len=0","443","51286"
"232","3.380016","0.000088","192.168.68.121","162.159.61.3","TCP","54","51289  >  443 [ACK] Seq=1801 Ack=2 Win=131584 Len=0","51289","443"
"233","3.380111","0.000095","162.159.61.3","192.168.68.121","TCP","60","443  >  51286 [ACK] Seq=3775 Ack=2152 Win=77824 Len=0","443","51286"
"234","3.380152","0.000041","162.159.61.3","192.168.68.121","TCP","60","443  >  51286 [ACK] Seq=3775 Ack=2208 Win=77824 Len=0","443","51286"
"235","3.380152","0.000000","162.159.61.3","192.168.68.121","TCP","60","443  >  51286 [ACK] Seq=3775 Ack=2264 Win=77824 Len=0","443","51286"
"236","3.380152","0.000000","162.159.61.3","192.168.68.121","TCP","60","443  >  51286 [ACK] Seq=3775 Ack=2423 Win=77824 Len=0","443","51286"
"237","3.384453","0.004301","162.159.61.3","192.168.68.121","TCP","60","443  >  51286 [ACK] Seq=3775 Ack=2582 Win=81920 Len=0","443","51286"
"238","3.385842","0.001389","162.159.61.3","192.168.68.121","TCP","60","443  >  51286 [ACK] Seq=3775 Ack=2741 Win=86016 Len=0","443","51286"
"239","3.385842","0.000000","162.159.61.3","192.168.68.121","TCP","60","443  >  51286 [ACK] Seq=3775 Ack=2900 Win=86016 Len=0","443","51286"
"240","3.385842","0.000000","162.159.61.3","192.168.68.121","HTTP2","731","WINDOW_UPDATE[7]","443","51286"
"241","3.386349","0.000507","192.168.68.121","162.159.61.3","HTTP2","85","SETTINGS[0]","51286","443"
"242","3.387678","0.001329","162.159.61.3","192.168.68.121","TLSv1.3","1454","Server Hello, Change Cipher Spec","443","51287"
"243","3.387797","0.000119","192.168.68.121","162.159.61.3","TCP","54","51287  >  443 [RST, ACK] Seq=1833 Ack=1401 Win=0 Len=0","51287","443"
"244","3.391177","0.003380","162.159.61.3","192.168.68.121","TCP","1454","443  >  51287 [PSH, ACK] Seq=1401 Ack=1833 Win=73728 Len=1400 [TCP PDU reassembled in 245]","443","51287"
"245","3.391177","0.000000","162.159.61.3","192.168.68.121","TLSv1.3","1026","Application Data","443","51287"
"246","3.391177","0.000000","162.159.61.3","192.168.68.121","TCP","54","443  >  51287 [FIN, ACK] Seq=3773 Ack=1833 Win=73728 Len=0","443","51287"
"247","3.393559","0.002382","192.168.68.121","162.159.61.3","HTTP2","116","HEADERS[9]: POST /dns-query","51286","443"
"248","3.393674","0.000115","192.168.68.121","162.159.61.3","HTTP2","110","HEADERS[11]: POST /dns-query","51286","443"
"249","3.393738","0.000064","192.168.68.121","162.159.61.3","DoH","213","Standard query 0x0000 A chatgpt.com OPT","51286","443"
"250","3.393793","0.000055","192.168.68.121","162.159.61.3","DoH","213","Standard query 0x0000 HTTPS chatgpt.com OPT","51286","443"
"251","3.397321","0.003528","192.168.68.121","162.159.61.3","HTTP2","110","HEADERS[13]: POST /dns-query","51286","443"
"252","3.397442","0.000121","192.168.68.121","162.159.61.3","HTTP2","110","HEADERS[15]: POST /dns-query","51286","443"
"253","3.397554","0.000112","192.168.68.121","162.159.61.3","DoH","213","Standard query 0x0000 A webapp.chatgpt4google.com OPT","51286","443"
"254","3.397627","0.000073","192.168.68.121","162.159.61.3","DoH","213","Standard query 0x0000 HTTPS webapp.chatgpt4google.com OPT","51286","443"
"255","3.398826","0.001199","162.159.61.3","192.168.68.121","HTTP2","1454","Standard query response 0x0000 A accounts.google.com A 142.251.168.84 OPT, Standard query response 0x0000 A www.google.com A 142.250.75.68 OPT, HEADERS[5]: 200 OK","443","51286"
"256","3.398895","0.000069","192.168.68.121","162.159.61.3","TCP","54","51286  >  443 [ACK] Seq=3797 Ack=5852 Win=131584 Len=0","51286","443"
"257","3.404803","0.005908","162.159.61.3","192.168.68.121","DoH","959","Standard query response 0x0000 HTTPS www.google.com HTTPS OPT, Standard query response 0x0000 HTTPS accounts.google.com SOA ns1.google.com OPT","443","51286"
"258","3.404803","0.000000","162.159.61.3","192.168.68.121","TCP","66","[TCP Dup ACK 230#1] 443  >  51289 [ACK] Seq=2 Ack=1801 Win=73728 Len=0 SLE=400 SRE=1801","443","51289"
"259","3.404803","0.000000","162.159.61.3","192.168.68.121","TCP","60","443  >  51286 [ACK] Seq=6757 Ack=2931 Win=86016 Len=0","443","51286"
"260","3.404865","0.000062","192.168.68.121","162.159.61.3","TCP","54","51286  >  443 [ACK] Seq=3797 Ack=6757 Win=130560 Len=0","51286","443"
"261","3.405263","0.000398","192.168.68.121","142.250.75.68","TCP","66","51290  >  443 [SYN] Seq=0 Win=64240 Len=0 MSS=1460 WS=256 SACK_PERM","51290","443"
"262","3.405619","0.000356","192.168.68.121","142.251.168.84","TCP","66","51291  >  443 [SYN] Seq=0 Win=64240 Len=0 MSS=1460 WS=256 SACK_PERM","51291","443"
"263","3.405929","0.000310","192.168.68.121","142.250.75.68","TCP","66","51292  >  443 [SYN] Seq=0 Win=64240 Len=0 MSS=1460 WS=256 SACK_PERM","51292","443"
"264","3.410945","0.005016","162.159.61.3","192.168.68.121","TCP","60","443  >  51286 [ACK] Seq=6757 Ack=2993 Win=86016 Len=0","443","51286"
"265","3.410945","0.000000","162.159.61.3","192.168.68.121","TCP","60","443  >  51286 [ACK] Seq=6757 Ack=3049 Win=86016 Len=0","443","51286"
"266","3.411977","0.001032","192.168.68.121","192.168.1.1","DNS","87","Standard query 0x05fa PTR 84.168.251.142.in-addr.arpa","52324","53"
"267","3.415348","0.003371","162.159.61.3","192.168.68.121","TCP","60","443  >  51286 [ACK] Seq=6757 Ack=3208 Win=90112 Len=0","443","51286"
"268","3.415348","0.000000","162.159.61.3","192.168.68.121","TCP","60","443  >  51286 [ACK] Seq=6757 Ack=3367 Win=94208 Len=0","443","51286"
