"No.","Time","Delta-time","Source","Destination","Protocol","Length","Info","Source port","Destination port"
"1","0.000000","0.000000","192.168.68.100","255.255.255.255","UDP","207","20000  >  10002 Len=165","20000","10002"
"2","0.999455","0.999455","192.168.68.100","255.255.255.255","UDP","207","20000  >  10002 Len=165","20000","10002"
"3","1.094435","0.094980","192.168.68.121","192.168.1.1","DNS","85","Standard query 0x323e A chrome.cloudflare-dns.com","53523","53"
"4","1.094862","0.000427","192.168.68.121","192.168.1.1","DNS","85","Standard query 0xd56d HTTPS chrome.cloudflare-dns.com","61244","53"
"5","1.117619","0.022757","192.168.1.1","192.168.68.121","DNS","117","Standard query response 0x323e A chrome.cloudflare-dns.com A 172.64.41.3 A 162.159.61.3","53","53523"
"6","1.120256","0.002637","192.168.1.1","192.168.68.121","DNS","158","Standard query response 0xd56d HTTPS chrome.cloudflare-dns.com HTTPS","53","61244"
"7","1.123010","0.002754","192.168.68.121","172.64.41.3","QUIC","1292","Initial, DCID=6550b820c38261e9, PKN: 1, PING, CRYPTO, CRYPTO, PING, PING, PADDING, CRYPTO, CRYPTO, PING, PING, PADDING, CRYPTO, PING, CRYPTO, PING, CRYPTO, CRYPTO, PING, PADDING, CRYPTO, CRYPTO","63164","443"
"8","1.123155","0.000145","192.168.68.121","172.64.41.3","QUIC","1292","Initial, DCID=6550b820c38261e9, PKN: 2, PING, PADDING, CRYPTO, PADDING, CRYPTO, PADDING, CRYPTO, PING, CRYPTO, PING, PADDING, CRYPTO, CRYPTO, PADDING, PING, CRYPTO, CRYPTO, CRYPTO, PADDING","63164","443"
"9","1.123859","0.000704","192.168.68.121","172.64.41.3","TCP","66","52416  >  443 [SYN] Seq=0 Win=64240 Len=0 MSS=1460 WS=256 SACK_PERM","52416","443"
"10","1.124267","0.000408","192.168.68.121","172.64.41.3","TCP","66","52417  >  443 [SYN] Seq=0 Win=64240 Len=0 MSS=1460 WS=256 SACK_PERM","52417","443"
"11","1.137670","0.013403","192.168.68.121","192.168.1.1","DNS","84","Standard query 0xcbc5 PTR 3.41.64.172.in-addr.arpa","57337","53"
"12","1.158444","0.020774","192.168.68.121","192.168.68.1","DNS","84","Standard query 0xcbc5 PTR 3.41.64.172.in-addr.arpa","57337","53"
"13","1.174839","0.016395","172.64.41.3","192.168.68.121","TCP","66","443  >  52417 [SYN, ACK] Seq=0 Ack=1 Win=65535 Len=0 MSS=1400 SACK_PERM WS=4096","443","52417"
"14","1.174839","0.000000","172.64.41.3","192.168.68.121","TCP","66","443  >  52416 [SYN, ACK] Seq=0 Ack=1 Win=65535 Len=0 MSS=1400 SACK_PERM WS=4096","443","52416"
"15","1.174839","0.000000","192.168.1.1","192.168.68.121","DNS","146","Standard query response 0xcbc5 No such name PTR 3.41.64.172.in-addr.arpa SOA cruz.ns.cloudflare.com","53","57337"
"16","1.174968","0.000129","192.168.68.121","172.64.41.3","TCP","54","52417  >  443 [ACK] Seq=1 Ack=1 Win=131584 Len=0","52417","443"
"17","1.175014","0.000046","192.168.68.121","172.64.41.3","TCP","54","52416  >  443 [ACK] Seq=1 Ack=1 Win=131584 Len=0","52416","443"
"18","1.175738","0.000724","192.168.68.121","224.0.0.251","MDNS","90","Standard query 0x0000 PTR 3.41.64.172.in-addr.arpa.local, ""QM"" question","5353","5353"
"19","1.175797","0.000059","192.168.68.121","172.64.41.3","TCP","1454","52417  >  443 [ACK] Seq=1 Ack=1 Win=131584 Len=1400 [TCP PDU reassembled in 20]","52417","443"
"20","1.175797","0.000000","192.168.68.121","172.64.41.3","TLSv1.3","453","Client Hello (SNI=chrome.cloudflare-dns.com)","52417","443"
"21","1.176115","0.000318","fe80::dc4b:6313:da4f:dd3","ff02::fb","MDNS","110","Standard query 0x0000 PTR 3.41.64.172.in-addr.arpa.local, ""QM"" question","5353","5353"
"22","1.176351","0.000236","192.168.68.121","172.64.41.3","TCP","1454","52416  >  443 [ACK] Seq=1 Ack=1 Win=131584 Len=1400 [TCP PDU reassembled in 23]","52416","443"
"23","1.176351","0.000000","192.168.68.121","172.64.41.3","TLSv1.3","485","Client Hello (SNI=chrome.cloudflare-dns.com)","52416","443"
"24","1.177174","0.000823","192.168.68.121","224.0.0.251","MDNS","90","Standard query 0x0000 PTR 3.41.64.172.in-addr.arpa.local, ""QM"" question","5353","5353"
"25","1.177681","0.000507","fe80::dc4b:6313:da4f:dd3","ff02::fb","MDNS","110","Standard query 0x0000 PTR 3.41.64.172.in-addr.arpa.local, ""QM"" question","5353","5353"
"26","1.180208","0.002527","192.168.68.1","192.168.68.121","DNS","146","Standard query response 0xcbc5 No such name PTR 3.41.64.172.in-addr.arpa SOA cruz.ns.cloudflare.com","53","57337"
"27","1.185843","0.005635","192.168.68.121","192.168.1.1","DNS","84","Standard query 0xa4df PTR 3.41.64.172.in-addr.arpa","60936","53"
"28","1.220051","0.034208","172.64.41.3","192.168.68.121","TCP","60","443  >  52416 [ACK] Seq=1 Ack=1401 Win=69632 Len=0","443","52416"
"29","1.220051","0.000000","172.64.41.3","192.168.68.121","TCP","60","443  >  52417 [ACK] Seq=1 Ack=1401 Win=69632 Len=0","443","52417"
"30","1.220051","0.000000","172.64.41.3","192.168.68.121","TCP","60","443  >  52417 [ACK] Seq=1 Ack=1800 Win=73728 Len=0","443","52417"
"31","1.220952","0.000901","172.64.41.3","192.168.68.121","TCP","60","443  >  52416 [ACK] Seq=1 Ack=1832 Win=73728 Len=0","443","52416"
"32","1.220952","0.000000","172.64.41.3","192.168.68.121","TLSv1.3","1454","Server Hello, Change Cipher Spec","443","52417"
"33","1.220952","0.000000","172.64.41.3","192.168.68.121","TCP","1454","443  >  52417 [PSH, ACK] Seq=1401 Ack=1800 Win=73728 Len=1400 [TCP PDU reassembled in 34]","443","52417"
"34","1.220952","0.000000","172.64.41.3","192.168.68.121","TLSv1.3","1028","Encrypted Extensions, Compressed Certificate, Certificate Verify, Finished","443","52417"
"35","1.221000","0.000048","192.168.68.121","192.168.68.1","DNS","84","Standard query 0xa4df PTR 3.41.64.172.in-addr.arpa","60936","53"
"36","1.221020","0.000020","192.168.68.121","172.64.41.3","TCP","54","52417  >  443 [ACK] Seq=1800 Ack=3775 Win=131584 Len=0","52417","443"
"37","1.223915","0.002895","172.64.41.3","192.168.68.121","TLSv1.3","1454","Server Hello, Change Cipher Spec","443","52416"
"38","1.223915","0.000000","192.168.1.1","192.168.68.121","DNS","146","Standard query response 0xa4df No such name PTR 3.41.64.172.in-addr.arpa SOA cruz.ns.cloudflare.com","53","60936"
"39","1.223915","0.000000","172.64.41.3","192.168.68.121","TCP","1454","443  >  52416 [PSH, ACK] Seq=1401 Ack=1832 Win=73728 Len=1400 [TCP PDU reassembled in 40]","443","52416"
"40","1.223915","0.000000","172.64.41.3","192.168.68.121","TLSv1.3","1027","Encrypted Extensions, Compressed Certificate, Certificate Verify, Finished","443","52416"
"41","1.224016","0.000101","192.168.68.121","172.64.41.3","TCP","54","52416  >  443 [ACK] Seq=1832 Ack=3774 Win=131584 Len=0","52416","443"
"42","1.224398","0.000382","192.168.68.121","224.0.0.251","MDNS","90","Standard query 0x0000 PTR 3.41.64.172.in-addr.arpa.local, ""QM"" question","5353","5353"
"43","1.224617","0.000219","fe80::dc4b:6313:da4f:dd3","ff02::fb","MDNS","110","Standard query 0x0000 PTR 3.41.64.172.in-addr.arpa.local, ""QM"" question","5353","5353"
"44","1.232508","0.007891","192.168.68.121","172.64.41.3","TLSv1.3","118","Change Cipher Spec, Finished","52417","443"
"45","1.232969","0.000461","192.168.68.121","172.64.41.3","TLSv1.3","118","Change Cipher Spec, Finished","52416","443"
"46","1.233208","0.000239","192.168.68.121","172.64.41.3","TCP","54","52416  >  443 [FIN, ACK] Seq=1896 Ack=3774 Win=131584 Len=0","52416","443"
"47","1.233367","0.000159","192.168.68.121","172.64.41.3","HTTP2","146","Magic, SETTINGS[0], WINDOW_UPDATE[0]","52417","443"
"48","1.233771","0.000404","192.168.68.121","172.64.41.3","HTTP2","194","HEADERS[1]: POST /dns-query","52417","443"
"49","1.233856","0.000085","192.168.68.121","172.64.41.3","HTTP2","110","HEADERS[3]: POST /dns-query","52417","443"
"50","1.233911","0.000055","192.168.68.121","172.64.41.3","DoH","213","Standard query 0x0000 A clientservices.googleapis.com OPT","52417","443"
"51","1.233987","0.000076","192.168.68.121","172.64.41.3","DoH","213","Standard query 0x0000 HTTPS clientservices.googleapis.com OPT","52417","443"
"52","1.253942","0.019955","172.64.41.3","192.168.68.121","TCP","60","443  >  52417 [ACK] Seq=3775 Ack=1864 Win=73728 Len=0","443","52417"
"53","1.253942","0.000000","172.64.41.3","192.168.68.121","TCP","54","443  >  52416 [ACK] Seq=3774 Ack=1896 Win=73728 Len=0","443","52416"
"54","1.253942","0.000000","172.64.41.3","192.168.68.121","TCP","60","443  >  52417 [ACK] Seq=3775 Ack=1956 Win=73728 Len=0","443","52417"
"55","1.253942","0.000000","172.64.41.3","192.168.68.121","HTTP2","582","SETTINGS[0], WINDOW_UPDATE[0]","443","52417"
"56","1.254331","0.000389","192.168.68.121","172.64.41.3","HTTP2","85","SETTINGS[0]","52417","443"
"57","1.255078","0.000747","172.64.41.3","192.168.68.121","HTTP2","85","SETTINGS[0]","443","52417"
"58","1.255078","0.000000","192.168.68.1","192.168.68.121","DNS","146","Standard query response 0xa4df No such name PTR 3.41.64.172.in-addr.arpa SOA cruz.ns.cloudflare.com","53","60936"
"59","1.265035","0.009957","172.64.41.3","192.168.68.121","TCP","60","443  >  52417 [ACK] Seq=4334 Ack=2096 Win=77824 Len=0","443","52417"
"60","1.265035","0.000000","172.64.41.3","192.168.68.121","TCP","54","443  >  52416 [FIN, ACK] Seq=3774 Ack=1897 Win=73728 Len=0","443","52416"
"61","1.265035","0.000000","172.64.41.3","192.168.68.121","TCP","60","443  >  52417 [ACK] Seq=4334 Ack=2152 Win=77824 Len=0","443","52417"
"62","1.265105","0.000070","192.168.68.121","172.64.41.3","TCP","54","52416  >  443 [ACK] Seq=1897 Ack=3775 Win=131584 Len=0","52416","443"
"63","1.267383","0.002278","172.64.41.3","192.168.68.121","TCP","60","443  >  52417 [ACK] Seq=4334 Ack=2311 Win=77824 Len=0","443","52417"
"64","1.267383","0.000000","172.64.41.3","192.168.68.121","HTTP2","89","WINDOW_UPDATE[1]","443","52417"
"65","1.267383","0.000000","172.64.41.3","192.168.68.121","HTTP2","89","WINDOW_UPDATE[3]","443","52417"
"66","1.267470","0.000087","192.168.68.121","172.64.41.3","TCP","54","52417  >  443 [ACK] Seq=2501 Ack=4404 Win=130816 Len=0","52417","443"
"67","1.271062","0.003592","172.64.41.3","192.168.68.121","HTTP2","195","HEADERS[1]: 200 OK","443","52417"
"68","1.271113","0.000051","192.168.68.121","172.64.41.3","TCP","54","52417  >  443 [ACK] Seq=2501 Ack=4545 Win=130816 Len=0","52417","443"
"69","1.272363","0.001250","172.64.41.3","192.168.68.121","DoH","553","Standard query response 0x0000 A clientservices.googleapis.com A 142.250.75.131 OPT","443","52417"
"70","1.272363","0.000000","172.64.41.3","192.168.68.121","HTTP2","110","HEADERS[3]: 200 OK","443","52417"
"71","1.272363","0.000000","172.64.41.3","192.168.68.121","DoH","553","Standard query response 0x0000 HTTPS clientservices.googleapis.com SOA ns1.google.com OPT","443","52417"
"72","1.272453","0.000090","192.168.68.121","172.64.41.3","TCP","54","52417  >  443 [ACK] Seq=2501 Ack=5599 Win=131584 Len=0","52417","443"
"73","1.273436","0.000983","192.168.68.121","142.250.75.131","TCP","66","52418  >  443 [SYN] Seq=0 Win=64240 Len=0 MSS=1460 WS=256 SACK_PERM","52418","443"
"74","1.292166","0.018730","142.250.75.131","192.168.68.121","TCP","66","443  >  52418 [SYN, ACK] Seq=0 Ack=1 Win=65535 Len=0 MSS=1400 SACK_PERM WS=4096","443","52418"
"75","1.292266","0.000100","192.168.68.121","142.250.75.131","TCP","54","52418  >  443 [ACK] Seq=1 Ack=1 Win=131584 Len=0","52418","443"
"76","1.292696","0.000430","192.168.68.121","142.250.75.131","TCP","1454","52418  >  443 [ACK] Seq=1 Ack=1 Win=131584 Len=1400 [TCP PDU reassembled in 77]","52418","443"
"77","1.292696","0.000000","192.168.68.121","142.250.75.131","TLSv1.3","457","Client Hello (SNI=clientservices.googleapis.com)","52418","443"
"78","1.297296","0.004600","192.168.68.121","192.168.1.1","DNS","84","Standard query 0xac6a PTR 3.41.64.172.in-addr.arpa","62036","53"
"79","1.317102","0.019806","142.250.75.131","192.168.68.121","TCP","60","443  >  52418 [ACK] Seq=1 Ack=1401 Win=69632 Len=0","443","52418"
"80","1.318495","0.001393","142.250.75.131","192.168.68.121","TCP","60","443  >  52418 [ACK] Seq=1 Ack=1804 Win=73728 Len=0","443","52418"
"81","1.318495","0.000000","192.168.1.1","192.168.68.121","DNS","146","Standard query response 0xac6a No such name PTR 3.41.64.172.in-addr.arpa SOA cruz.ns.cloudflare.com","53","62036"
"82","1.318495","0.000000","172.64.41.3","192.168.68.121","TCP","60","443  >  52417 [ACK] Seq=5599 Ack=2501 Win=81920 Len=0","443","52417"
"83","1.318944","0.000449","192.168.68.121","224.0.0.251","MDNS","90","Standard query 0x0000 PTR 3.41.64.172.in-addr.arpa.local, ""QM"" question","5353","5353"
"84","1.319178","0.000234","fe80::dc4b:6313:da4f:dd3","ff02::fb","MDNS","110","Standard query 0x0000 PTR 3.41.64.172.in-addr.arpa.local, ""QM"" question","5353","5353"
"85","1.419242","0.100064","142.250.75.131","192.168.68.121","TLSv1.3","1454","Server Hello, Change Cipher Spec","443","52418"
"86","1.419242","0.000000","142.250.75.131","192.168.68.121","TCP","1454","443  >  52418 [PSH, ACK] Seq=1401 Ack=1804 Win=73728 Len=1400 [TCP PDU reassembled in 90]","443","52418"
"87","1.419334","0.000092","192.168.68.121","142.250.75.131","TCP","54","52418  >  443 [ACK] Seq=1804 Ack=2801 Win=131584 Len=0","52418","443"
"88","1.421682","0.002348","142.250.75.131","192.168.68.121","TCP","1454","443  >  52418 [ACK] Seq=2801 Ack=1804 Win=73728 Len=1400 [TCP PDU reassembled in 90]","443","52418"
"89","1.421682","0.000000","142.250.75.131","192.168.68.121","TCP","1454","443  >  52418 [PSH, ACK] Seq=4201 Ack=1804 Win=73728 Len=1400 [TCP PDU reassembled in 90]","443","52418"
"90","1.421682","0.000000","142.250.75.131","192.168.68.121","TLSv1.3","213","Encrypted Extensions, Certificate, Certificate Verify, Finished","443","52418"
"91","1.421767","0.000085","192.168.68.121","142.250.75.131","TCP","54","52418  >  443 [ACK] Seq=1804 Ack=5760 Win=131584 Len=0","52418","443"
"92","1.424215","0.002448","192.168.68.121","172.64.41.3","QUIC","1292","Initial, DCID=6550b820c38261e9, PKN: 4, PING, CRYPTO, CRYPTO, PING, PADDING, CRYPTO, PADDING, CRYPTO, PADDING, CRYPTO, CRYPTO, PADDING, CRYPTO, PING, PING, PADDING, PING, PING, PADDING, PING, CRYPTO, PING","63164","443"
"93","1.424912","0.000697","192.168.68.121","142.250.75.131","TLSv1.3","128","Change Cipher Spec, Encrypted Extensions, Finished","52418","443"
"94","1.425331","0.000419","192.168.68.121","142.250.75.131","HTTP2","146","Magic, SETTINGS[0], WINDOW_UPDATE[0]","52418","443"
"95","1.425614","0.000283","192.168.68.121","142.250.75.131","HTTP2","425","HEADERS[1]: GET /chrome-variations/seed?osname=win&channel=stable&milestone=133","52418","443"
"96","1.443345","0.017731","142.250.75.131","192.168.68.121","TCP","60","443  >  52418 [ACK] Seq=5760 Ack=1878 Win=73728 Len=0","443","52418"
"97","1.443345","0.000000","142.250.75.131","192.168.68.121","TCP","60","443  >  52418 [ACK] Seq=5760 Ack=1970 Win=73728 Len=0","443","52418"
"98","1.447934","0.004589","142.250.75.131","192.168.68.121","TCP","60","443  >  52418 [ACK] Seq=5760 Ack=2341 Win=77824 Len=0","443","52418"
"99","1.447934","0.000000","142.250.75.131","192.168.68.121","HTTP2","1042","SETTINGS[0], WINDOW_UPDATE[0]","443","52418"
"100","1.448413","0.000479","192.168.68.121","142.250.75.131","HTTP2","85","SETTINGS[0]","52418","443"
"101","1.459353","0.010940","142.250.75.131","192.168.68.121","HTTP2","85","SETTINGS[0]","443","52418"
"102","1.472979","0.013626","142.250.75.131","192.168.68.121","TCP","60","443  >  52418 [ACK] Seq=6779 Ack=2372 Win=77824 Len=0","443","52418"
"103","1.503842","0.030863","192.168.68.121","142.250.75.131","TCP","54","52418  >  443 [ACK] Seq=2372 Ack=6779 Win=130560 Len=0","52418","443"
"104","1.537465","0.033623","TPLink_c5:e0:64","Broadcast","ARP","60","Who has 192.168.68.106? Tell 192.168.68.1","",""
"105","1.592388","0.054923","142.250.75.131","192.168.68.121","HTTP2","557","PING[0]","443","52418"
"106","1.593792","0.001404","192.168.68.121","142.250.75.131","HTTP2","93","PING[0]","52418","443"
"107","1.610862","0.017070","192.168.68.121","142.250.75.131","TCP","54","52418  >  443 [FIN, ACK] Seq=2411 Ack=7282 Win=131584 Len=0","52418","443"
"108","1.611034","0.000172","192.168.68.121","172.64.41.3","TCP","54","52417  >  443 [FIN, ACK] Seq=2501 Ack=5599 Win=131584 Len=0","52417","443"
"109","1.614260","0.003226","142.250.75.131","192.168.68.121","TCP","60","443  >  52418 [ACK] Seq=7282 Ack=2411 Win=77824 Len=0","443","52418"
"110","1.637309","0.023049","172.64.41.3","192.168.68.121","TCP","54","443  >  52417 [FIN, ACK] Seq=5599 Ack=2502 Win=81920 Len=0","443","52417"
"111","1.637357","0.000048","192.168.68.121","172.64.41.3","TCP","54","52417  >  443 [ACK] Seq=2502 Ack=5600 Win=131584 Len=0","52417","443"
"112","1.676368","0.039011","142.250.75.131","192.168.68.121","TCP","54","443  >  52418 [ACK] Seq=7282 Ack=2412 Win=77824 Len=0","443","52418"
"113","1.767685","0.091317","142.250.75.131","192.168.68.121","TCP","54","443  >  52418 [FIN, ACK] Seq=7282 Ack=2412 Win=77824 Len=0","443","52418"
"114","1.767743","0.000058","192.168.68.121","142.250.75.131","TCP","54","52418  >  443 [ACK] Seq=2412 Ack=7283 Win=131584 Len=0","52418","443"
"115","1.999878","0.232135","192.168.68.100","255.255.255.255","UDP","207","20000  >  10002 Len=165","20000","10002"
"116","2.035011","0.035133","192.168.68.121","172.64.41.3","QUIC","1292","Initial, DCID=6550b820c38261e9, PKN: 6, PING, PING, PADDING, PING, PING, PING, PING, CRYPTO, PADDING, PING, PADDING, CRYPTO, PING, PING, CRYPTO, PADDING","63164","443"
"117","2.176422","0.141411","192.168.68.121","224.0.0.251","MDNS","90","Standard query 0x0000 PTR 3.41.64.172.in-addr.arpa.local, ""QM"" question","5353","5353"
"118","2.176956","0.000534","fe80::dc4b:6313:da4f:dd3","ff02::fb","MDNS","110","Standard query 0x0000 PTR 3.41.64.172.in-addr.arpa.local, ""QM"" question","5353","5353"
"119","2.192016","0.015060","192.168.68.121","224.0.0.251","MDNS","90","Standard query 0x0000 PTR 3.41.64.172.in-addr.arpa.local, ""QM"" question","5353","5353"
"120","2.192436","0.000420","fe80::dc4b:6313:da4f:dd3","ff02::fb","MDNS","110","Standard query 0x0000 PTR 3.41.64.172.in-addr.arpa.local, ""QM"" question","5353","5353"
"121","2.193537","0.001101","192.168.68.121","192.168.1.1","DNS","84","Standard query 0x8180 PTR 3.41.64.172.in-addr.arpa","62907","53"
"122","2.224853","0.031316","192.168.68.121","192.168.68.1","DNS","84","Standard query 0x8180 PTR 3.41.64.172.in-addr.arpa","62907","53"
"123","2.225111","0.000258","192.168.68.121","224.0.0.251","MDNS","90","Standard query 0x0000 PTR 3.41.64.172.in-addr.arpa.local, ""QM"" question","5353","5353"
"124","2.225544","0.000433","fe80::dc4b:6313:da4f:dd3","ff02::fb","MDNS","110","Standard query 0x0000 PTR 3.41.64.172.in-addr.arpa.local, ""QM"" question","5353","5353"
"125","2.236405","0.010861","192.168.1.1","192.168.68.121","DNS","146","Standard query response 0x8180 No such name PTR 3.41.64.172.in-addr.arpa SOA cruz.ns.cloudflare.com","53","62907"
"126","2.236950","0.000545","192.168.68.121","224.0.0.251","MDNS","90","Standard query 0x0000 PTR 3.41.64.172.in-addr.arpa.local, ""QM"" question","5353","5353"
"127","2.237239","0.000289","fe80::dc4b:6313:da4f:dd3","ff02::fb","MDNS","110","Standard query 0x0000 PTR 3.41.64.172.in-addr.arpa.local, ""QM"" question","5353","5353"
"128","2.257113","0.019874","192.168.68.1","192.168.68.121","DNS","146","Standard query response 0x8180 No such name PTR 3.41.64.172.in-addr.arpa SOA cruz.ns.cloudflare.com","53","62907"
"129","2.312312","0.055199","192.168.68.121","224.0.0.251","MDNS","90","Standard query 0x0000 PTR 3.41.64.172.in-addr.arpa.local, ""QM"" question","5353","5353"
"130","2.312659","0.000347","fe80::dc4b:6313:da4f:dd3","ff02::fb","MDNS","110","Standard query 0x0000 PTR 3.41.64.172.in-addr.arpa.local, ""QM"" question","5353","5353"
"131","2.658242","0.345583","192.168.68.121","192.168.1.1","DNS","85","Standard query 0x24d0 A chrome.cloudflare-dns.com","63696","53"
"132","2.658810","0.000568","192.168.68.121","192.168.1.1","DNS","85","Standard query 0xc170 HTTPS chrome.cloudflare-dns.com","53141","53"
"133","2.685600","0.026790","192.168.1.1","192.168.68.121","DNS","158","Standard query response 0xc170 HTTPS chrome.cloudflare-dns.com HTTPS","53","53141"
"134","2.685600","0.000000","192.168.1.1","192.168.68.121","DNS","117","Standard query response 0x24d0 A chrome.cloudflare-dns.com A 162.159.61.3 A 172.64.41.3","53","63696"
"135","2.688810","0.003210","192.168.68.121","162.159.61.3","QUIC","1292","Initial, DCID=6e517e9e4fbc0fc8, PKN: 1, PADDING, CRYPTO, CRYPTO, CRYPTO, PADDING, PING, CRYPTO, PING, PING, PING, CRYPTO, CRYPTO, PADDING, PING, PADDING, PING","52575","443"
"136","2.688944","0.000134","192.168.68.121","162.159.61.3","QUIC","1292","Initial, DCID=6e517e9e4fbc0fc8, PKN: 2, CRYPTO, PADDING, PING, PADDING, CRYPTO, PING, CRYPTO, PADDING, PING, CRYPTO, PADDING","52575","443"
"137","2.724329","0.035385","192.168.68.121","192.168.1.1","DNS","85","Standard query 0x9e16 PTR 3.61.159.162.in-addr.arpa","52134","53"
"138","2.735881","0.011552","192.168.68.121","162.159.61.3","TCP","66","52419  >  443 [SYN] Seq=0 Win=64240 Len=0 MSS=1460 WS=256 SACK_PERM","52419","443"
"139","2.736363","0.000482","192.168.68.121","162.159.61.3","TCP","66","52420  >  443 [SYN] Seq=0 Win=64240 Len=0 MSS=1460 WS=256 SACK_PERM","52420","443"
"140","2.762032","0.025669","192.168.68.121","192.168.68.1","DNS","85","Standard query 0x9e16 PTR 3.61.159.162.in-addr.arpa","52134","53"
"141","2.766734","0.004702","192.168.1.1","192.168.68.121","DNS","147","Standard query response 0x9e16 No such name PTR 3.61.159.162.in-addr.arpa SOA cruz.ns.cloudflare.com","53","52134"
"142","2.766734","0.000000","162.159.61.3","192.168.68.121","TCP","66","443  >  52419 [SYN, ACK] Seq=0 Ack=1 Win=65535 Len=0 MSS=1400 SACK_PERM WS=4096","443","52419"
"143","2.766734","0.000000","162.159.61.3","192.168.68.121","TCP","66","443  >  52420 [SYN, ACK] Seq=0 Ack=1 Win=65535 Len=0 MSS=1400 SACK_PERM WS=4096","443","52420"
"144","2.766895","0.000161","192.168.68.121","162.159.61.3","TCP","54","52419  >  443 [ACK] Seq=1 Ack=1 Win=131584 Len=0","52419","443"
"145","2.766944","0.000049","192.168.68.121","162.159.61.3","TCP","54","52420  >  443 [ACK] Seq=1 Ack=1 Win=131584 Len=0","52420","443"
"146","2.767410","0.000466","192.168.68.121","162.159.61.3","TCP","1454","52419  >  443 [ACK] Seq=1 Ack=1 Win=131584 Len=1400 [TCP PDU reassembled in 147]","52419","443"
"147","2.767410","0.000000","192.168.68.121","162.159.61.3","TLSv1.3","453","Client Hello (SNI=chrome.cloudflare-dns.com)","52419","443"
"148","2.768028","0.000618","192.168.68.121","162.159.61.3","TCP","1454","52420  >  443 [ACK] Seq=1 Ack=1 Win=131584 Len=1400 [TCP PDU reassembled in 149]","52420","443"
"149","2.768028","0.000000","192.168.68.121","162.159.61.3","TLSv1.3","421","Client Hello (SNI=chrome.cloudflare-dns.com)","52420","443"
"150","2.768681","0.000653","192.168.68.121","224.0.0.251","MDNS","91","Standard query 0x0000 PTR 3.61.159.162.in-addr.arpa.local, ""QM"" question","5353","5353"
"151","2.769053","0.000372","fe80::dc4b:6313:da4f:dd3","ff02::fb","MDNS","111","Standard query 0x0000 PTR 3.61.159.162.in-addr.arpa.local, ""QM"" question","5353","5353"
"152","2.769675","0.000622","192.168.68.121","224.0.0.251","MDNS","91","Standard query 0x0000 PTR 3.61.159.162.in-addr.arpa.local, ""QM"" question","5353","5353"
"153","2.770052","0.000377","fe80::dc4b:6313:da4f:dd3","ff02::fb","MDNS","111","Standard query 0x0000 PTR 3.61.159.162.in-addr.arpa.local, ""QM"" question","5353","5353"
"154","2.784032","0.013980","192.168.68.1","192.168.68.121","DNS","147","Standard query response 0x9e16 No such name PTR 3.61.159.162.in-addr.arpa SOA cruz.ns.cloudflare.com","53","52134"
"155","2.789987","0.005955","192.168.68.121","192.168.1.1","DNS","85","Standard query 0xb6c5 PTR 3.61.159.162.in-addr.arpa","52734","53"
"156","2.813050","0.023063","162.159.61.3","192.168.68.121","TCP","60","443  >  52419 [ACK] Seq=1 Ack=1401 Win=69632 Len=0","443","52419"
"157","2.813050","0.000000","162.159.61.3","192.168.68.121","TCP","60","443  >  52419 [ACK] Seq=1 Ack=1800 Win=73728 Len=0","443","52419"
"158","2.817044","0.003994","162.159.61.3","192.168.68.121","TLSv1.3","1454","Server Hello, Change Cipher Spec","443","52419"
"159","2.817044","0.000000","162.159.61.3","192.168.68.121","TCP","1454","443  >  52419 [PSH, ACK] Seq=1401 Ack=1800 Win=73728 Len=1400 [TCP PDU reassembled in 160]","443","52419"
"160","2.817044","0.000000","162.159.61.3","192.168.68.121","TLSv1.3","1027","Encrypted Extensions, Compressed Certificate, Certificate Verify, Finished","443","52419"
"161","2.817127","0.000083","192.168.68.121","162.159.61.3","TCP","54","52419  >  443 [ACK] Seq=1800 Ack=3774 Win=131584 Len=0","52419","443"
"162","2.817630","0.000503","162.159.61.3","192.168.68.121","TCP","60","443  >  52420 [ACK] Seq=1 Ack=1401 Win=69632 Len=0","443","52420"
"163","2.819117","0.001487","192.168.1.1","192.168.68.121","DNS","147","Standard query response 0xb6c5 No such name PTR 3.61.159.162.in-addr.arpa SOA cruz.ns.cloudflare.com","53","52734"
"164","2.819117","0.000000","162.159.61.3","192.168.68.121","TCP","60","443  >  52420 [ACK] Seq=1 Ack=1768 Win=73728 Len=0","443","52420"
"165","2.820746","0.001629","192.168.68.121","224.0.0.251","MDNS","91","Standard query 0x0000 PTR 3.61.159.162.in-addr.arpa.local, ""QM"" question","5353","5353"
"166","2.821079","0.000333","fe80::dc4b:6313:da4f:dd3","ff02::fb","MDNS","111","Standard query 0x0000 PTR 3.61.159.162.in-addr.arpa.local, ""QM"" question","5353","5353"
"167","2.823519","0.002440","192.168.68.121","162.159.61.3","TLSv1.3","118","Change Cipher Spec, Finished","52419","443"
"168","2.823837","0.000318","192.168.68.121","162.159.61.3","HTTP2","146","Magic, SETTINGS[0], WINDOW_UPDATE[0]","52419","443"
"169","2.823964","0.000127","192.168.68.121","162.159.61.3","TCP","54","52420  >  443 [FIN, ACK] Seq=1768 Ack=1 Win=131584 Len=0","52420","443"
"170","2.824338","0.000374","192.168.68.121","162.159.61.3","HTTP2","194","HEADERS[1]: POST /dns-query","52419","443"
"171","2.824450","0.000112","192.168.68.121","162.159.61.3","HTTP2","110","HEADERS[3]: POST /dns-query","52419","443"
"172","2.824557","0.000107","192.168.68.121","162.159.61.3","DoH","213","Standard query 0x0000 A www.google.com OPT","52419","443"
"173","2.824631","0.000074","192.168.68.121","162.159.61.3","DoH","213","Standard query 0x0000 HTTPS www.google.com OPT","52419","443"
"174","2.849056","0.024425","162.159.61.3","192.168.68.121","TLSv1.3","1454","Server Hello, Change Cipher Spec","443","52420"
"175","2.849056","0.000000","162.159.61.3","192.168.68.121","TCP","1454","443  >  52420 [PSH, ACK] Seq=1401 Ack=1768 Win=73728 Len=1400 [TCP PDU reassembled in 176]","443","52420"
"176","2.849056","0.000000","162.159.61.3","192.168.68.121","TLSv1.3","1026","Application Data","443","52420"
"177","2.849135","0.000079","192.168.68.121","162.159.61.3","TCP","54","52420  >  443 [RST, ACK] Seq=1769 Ack=1401 Win=0 Len=0","52420","443"
"178","2.849345","0.000210","162.159.61.3","192.168.68.121","TCP","54","443  >  52420 [FIN, ACK] Seq=3773 Ack=1769 Win=73728 Len=0","443","52420"
"179","2.849345","0.000000","162.159.61.3","192.168.68.121","TCP","60","443  >  52419 [ACK] Seq=3774 Ack=1864 Win=73728 Len=0","443","52419"
"180","2.849345","0.000000","162.159.61.3","192.168.68.121","TCP","60","443  >  52419 [ACK] Seq=3774 Ack=1956 Win=73728 Len=0","443","52419"
"181","2.849345","0.000000","162.159.61.3","192.168.68.121","TCP","60","443  >  52419 [ACK] Seq=3774 Ack=2096 Win=77824 Len=0","443","52419"
"182","2.852773","0.003428","162.159.61.3","192.168.68.121","TCP","60","443  >  52419 [ACK] Seq=3774 Ack=2152 Win=77824 Len=0","443","52419"
"183","2.852773","0.000000","162.159.61.3","192.168.68.121","TCP","60","443  >  52419 [ACK] Seq=3774 Ack=2311 Win=77824 Len=0","443","52419"
"184","2.852773","0.000000","162.159.61.3","192.168.68.121","HTTP2","582","SETTINGS[0], WINDOW_UPDATE[0]","443","52419"
"185","2.852773","0.000000","162.159.61.3","192.168.68.121","TCP","60","443  >  52419 [ACK] Seq=4302 Ack=2470 Win=81920 Len=0","443","52419"
"186","2.852773","0.000000","162.159.61.3","192.168.68.121","HTTP2","85","SETTINGS[0]","443","52419"
"187","2.852773","0.000000","162.159.61.3","192.168.68.121","HTTP2","89","WINDOW_UPDATE[1]","443","52419"
"188","2.852773","0.000000","162.159.61.3","192.168.68.121","HTTP2","89","WINDOW_UPDATE[3]","443","52419"
"189","2.852866","0.000093","192.168.68.121","162.159.61.3","TCP","54","52419  >  443 [ACK] Seq=2470 Ack=4403 Win=130816 Len=0","52419","443"
"190","2.854275","0.001409","162.159.61.3","192.168.68.121","HTTP2","194","HEADERS[3]: 200 OK","443","52419"
"191","2.854811","0.000536","162.159.61.3","192.168.68.121","DoH","553","Standard query response 0x0000 HTTPS www.google.com HTTPS OPT","443","52419"
"192","2.854872","0.000061","192.168.68.121","162.159.61.3","TCP","54","52419  >  443 [ACK] Seq=2470 Ack=5042 Win=130304 Len=0","52419","443"
"193","2.866468","0.011596","192.168.68.121","162.159.61.3","HTTP2","85","SETTINGS[0]","52419","443"
"194","2.884183","0.017715","162.159.61.3","192.168.68.121","TCP","60","443  >  52419 [ACK] Seq=5042 Ack=2501 Win=81920 Len=0","443","52419"
"195","2.889885","0.005702","162.159.61.3","192.168.68.121","HTTP2","110","HEADERS[1]: 200 OK","443","52419"
"196","2.889885","0.000000","162.159.61.3","192.168.68.121","DoH","553","Standard query response 0x0000 A www.google.com A 142.250.75.132 OPT","443","52419"
"197","2.889954","0.000069","192.168.68.121","162.159.61.3","TCP","54","52419  >  443 [ACK] Seq=2501 Ack=5597 Win=131584 Len=0","52419","443"
"198","2.890668","0.000714","192.168.68.121","142.250.75.132","TCP","66","52421  >  443 [SYN] Seq=0 Win=64240 Len=0 MSS=1460 WS=256 SACK_PERM","52421","443"
"199","2.905608","0.014940","142.250.75.132","192.168.68.121","TCP","66","443  >  52421 [SYN, ACK] Seq=0 Ack=1 Win=65535 Len=0 MSS=1400 SACK_PERM WS=4096","443","52421"
"200","2.905711","0.000103","192.168.68.121","142.250.75.132","TCP","54","52421  >  443 [ACK] Seq=1 Ack=1 Win=131584 Len=0","52421","443"
"201","2.906232","0.000521","192.168.68.121","142.250.75.132","TCP","1454","52421  >  443 [ACK] Seq=1 Ack=1 Win=131584 Len=1400 [TCP PDU reassembled in 202]","52421","443"
"202","2.906232","0.000000","192.168.68.121","142.250.75.132","TLSv1.3","378","Client Hello (SNI=www.google.com)","52421","443"
"203","2.928465","0.022233","142.250.75.132","192.168.68.121","TCP","60","443  >  52421 [ACK] Seq=1 Ack=1401 Win=69632 Len=0","443","52421"
"204","2.930687","0.002222","142.250.75.132","192.168.68.121","TCP","60","443  >  52421 [ACK] Seq=1 Ack=1725 Win=73728 Len=0","443","52421"
"205","2.991874","0.061187","192.168.68.121","162.159.61.3","QUIC","1292","Initial, DCID=6e517e9e4fbc0fc8, PKN: 4, CRYPTO, PADDING, CRYPTO, CRYPTO, PING, CRYPTO, PING, PADDING, PING, PADDING, PING, PING, PING, PING, CRYPTO, PADDING, PING, CRYPTO, CRYPTO","52575","443"
"206","2.993276","0.001402","192.168.68.121","162.159.61.3","HTTP2","110","HEADERS[5]: POST /dns-query","52419","443"
"207","2.993421","0.000145","192.168.68.121","162.159.61.3","HTTP2","110","HEADERS[7]: POST /dns-query","52419","443"
"208","2.993481","0.000060","192.168.68.121","162.159.61.3","DoH","213","Standard query 0x0000 A accounts.google.com OPT","52419","443"
"209","2.993545","0.000064","192.168.68.121","162.159.61.3","DoH","213","Standard query 0x0000 HTTPS accounts.google.com OPT","52419","443"
"210","3.007470","0.013925","142.250.75.132","192.168.68.121","TLSv1.3","1454","Server Hello, Change Cipher Spec","443","52421"
"211","3.013581","0.006111","142.250.75.132","192.168.68.121","TCP","1454","443  >  52421 [PSH, ACK] Seq=1401 Ack=1725 Win=73728 Len=1400 [TCP PDU reassembled in 214]","443","52421"
"212","3.013581","0.000000","142.250.75.132","192.168.68.121","TCP","1454","443  >  52421 [ACK] Seq=2801 Ack=1725 Win=73728 Len=1400 [TCP PDU reassembled in 214]","443","52421"
"213","3.013657","0.000076","192.168.68.121","142.250.75.132","TCP","54","52421  >  443 [ACK] Seq=1725 Ack=4201 Win=131584 Len=0","52421","443"
"214","3.014890","0.001233","142.250.75.132","192.168.68.121","TLSv1.3","1233","Encrypted Extensions, Certificate, Certificate Verify, Finished","443","52421"
"215","3.014890","0.000000","162.159.61.3","192.168.68.121","TCP","60","443  >  52419 [ACK] Seq=5597 Ack=2613 Win=81920 Len=0","443","52419"
"216","3.014890","0.000000","162.159.61.3","192.168.68.121","TCP","60","443  >  52419 [ACK] Seq=5597 Ack=2931 Win=86016 Len=0","443","52419"
"217","3.014890","0.000000","162.159.61.3","192.168.68.121","HTTP2","89","WINDOW_UPDATE[5]","443","52419"
"218","3.014980","0.000090","192.168.68.121","142.250.75.132","TCP","54","52421  >  443 [ACK] Seq=1725 Ack=5380 Win=130304 Len=0","52421","443"
"219","3.017224","0.002244","192.168.68.121","142.250.75.132","TLSv1.3","128","Change Cipher Spec, Encrypted Extensions, Finished","52421","443"
"220","3.017577","0.000353","192.168.68.121","142.250.75.132","HTTP2","146","Magic, SETTINGS[0], WINDOW_UPDATE[0]","52421","443"
"221","3.018087","0.000510","192.168.68.121","142.250.75.132","TCP","1454","52421  >  443 [ACK] Seq=1891 Ack=5380 Win=130304 Len=1400 [TCP PDU reassembled in 222]","52421","443"
"222","3.018087","0.000000","192.168.68.121","142.250.75.132","HTTP2","648","HEADERS[1]: GET /complete/search?client=chrome-omni&gs_ri=chrome-ext-ansg&xssi=t&q=&oit=0&oft=1&pgcl=20&gs_rn=42&sugkey=AIzaSyA2KlwBX3mkFo30om9LUFYQhpqLoa_BNhE","52421","443"
"223","3.018206","0.000119","192.168.68.121","142.250.75.132","HTTP2","145","HEADERS[3]: GET /async/newtab_ogb?hl=he&async=fixed:0","52421","443"
"224","3.018284","0.000078","192.168.68.121","142.250.75.132","HTTP2","145","HEADERS[5]: GET /async/newtab_promos","52421","443"
"225","3.018372","0.000088","192.168.68.121","142.250.75.132","HTTP2","128","HEADERS[7]: GET /async/ddljson?async=ntp:2","52421","443"
"226","3.026232","0.007860","162.159.61.3","192.168.68.121","HTTP2","89","WINDOW_UPDATE[7]","443","52419"
"227","3.026232","0.000000","162.159.61.3","192.168.68.121","DoH","609","Standard query response 0x0000 HTTPS accounts.google.com SOA ns1.google.com OPT","443","52419"
"228","3.026315","0.000083","192.168.68.121","162.159.61.3","TCP","54","52419  >  443 [ACK] Seq=2931 Ack=6222 Win=130816 Len=0","52419","443"
"229","3.034097","0.007782","142.250.75.132","192.168.68.121","TCP","60","443  >  52421 [ACK] Seq=5380 Ack=1799 Win=73728 Len=0","443","52421"
"230","3.034097","0.000000","142.250.75.132","192.168.68.121","TCP","60","443  >  52421 [ACK] Seq=5380 Ack=1891 Win=73728 Len=0","443","52421"
"231","3.036202","0.002105","142.250.75.132","192.168.68.121","TCP","60","443  >  52421 [ACK] Seq=5380 Ack=3291 Win=77824 Len=0","443","52421"
"232","3.036202","0.000000","142.250.75.132","192.168.68.121","TCP","60","443  >  52421 [ACK] Seq=5380 Ack=3885 Win=77824 Len=0","443","52421"
"233","3.037353","0.001151","142.250.75.132","192.168.68.121","TCP","60","443  >  52421 [ACK] Seq=5380 Ack=3976 Win=77824 Len=0","443","52421"
"234","3.037353","0.000000","142.250.75.132","192.168.68.121","TCP","60","443  >  52421 [ACK] Seq=5380 Ack=4067 Win=77824 Len=0","443","52421"
"235","3.037353","0.000000","142.250.75.132","192.168.68.121","TCP","60","443  >  52421 [ACK] Seq=5380 Ack=4141 Win=77824 Len=0","443","52421"
"236","3.063359","0.026006","142.250.75.132","192.168.68.121","HTTP2","1101","SETTINGS[0]","443","52421"
"237","3.064316","0.000957","192.168.68.121","142.250.75.132","HTTP2","85","SETTINGS[0]","52421","443"
"238","3.072169","0.007853","162.159.61.3","192.168.68.121","HTTP2","110","HEADERS[5]: 200 OK","443","52419"
"239","3.072169","0.000000","162.159.61.3","192.168.68.121","DoH","553","Standard query response 0x0000 A accounts.google.com A 142.251.168.84 OPT","443","52419"
"240","3.072227","0.000058","192.168.68.121","162.159.61.3","TCP","54","52419  >  443 [ACK] Seq=2931 Ack=6777 Win=130304 Len=0","52419","443"
"241","3.072778","0.000551","192.168.68.121","142.251.168.84","TCP","66","52422  >  443 [SYN] Seq=0 Win=64240 Len=0 MSS=1460 WS=256 SACK_PERM","52422","443"
"242","3.082768","0.009990","142.250.75.132","192.168.68.121","TCP","60","443  >  52421 [ACK] Seq=6427 Ack=4172 Win=77824 Len=0","443","52421"
"243","3.099033","0.016265","142.251.168.84","192.168.68.121","TCP","66","443  >  52422 [SYN, ACK] Seq=0 Ack=1 Win=65535 Len=0 MSS=1400 SACK_PERM WS=4096","443","52422"
"244","3.099108","0.000075","192.168.68.121","142.251.168.84","TCP","54","52422  >  443 [ACK] Seq=1 Ack=1 Win=131584 Len=0","52422","443"
"245","3.099428","0.000320","192.168.68.121","142.251.168.84","TCP","1454","52422  >  443 [ACK] Seq=1 Ack=1 Win=131584 Len=1400 [TCP PDU reassembled in 246]","52422","443"
"246","3.099428","0.000000","192.168.68.121","142.251.168.84","TLSv1.3","447","Client Hello (SNI=accounts.google.com)","52422","443"
"247","3.133039","0.033611","142.251.168.84","192.168.68.121","TCP","60","443  >  52422 [ACK] Seq=1 Ack=1401 Win=69632 Len=0","443","52422"
"248","3.133039","0.000000","142.251.168.84","192.168.68.121","TCP","60","443  >  52422 [ACK] Seq=1 Ack=1794 Win=73728 Len=0","443","52422"
"249","3.141701","0.008662","142.250.75.132","192.168.68.121","HTTP2","906","DATA[5]","443","52421"
"250","3.141701","0.000000","142.250.75.132","192.168.68.121","HTTP2/JSON","85","DATA[5], JSON (application/json)","443","52421"
"251","3.141701","0.000000","142.250.75.132","192.168.68.121","HTTP2","93","PING[0]","443","52421"
"252","3.141852","0.000151","192.168.68.121","142.250.75.132","TCP","54","52421  >  443 [ACK] Seq=4172 Ack=7349 Win=130560 Len=0","52421","443"
"253","3.142250","0.000398","192.168.68.121","142.250.75.132","HTTP2","93","PING[0]","52421","443"
"254","3.146040","0.003790","142.250.75.132","192.168.68.121","HTTP2","342","HEADERS[7]: 200 OK","443","52421"
"255","3.146040","0.000000","142.250.75.132","192.168.68.121","HTTP2/JSON","139","DATA[7], JSON (application/json)","443","52421"
"256","3.146091","0.000051","192.168.68.121","142.250.75.132","TCP","54","52421  >  443 [ACK] Seq=4211 Ack=7722 Win=130304 Len=0","52421","443"
"257","3.166396","0.020305","142.250.75.132","192.168.68.121","HTTP2","1454","HEADERS[3]: 200 OK","443","52421"
"258","3.166396","0.000000","142.250.75.132","192.168.68.121","TLSv1.3","1454","[TLS segment of a reassembled PDU][TLS segment of a reassembled PDU]","443","52421"
"259","3.166396","0.000000","142.250.75.132","192.168.68.121","TLSv1.3","1454","[TLS segment of a reassembled PDU]","443","52421"
"260","3.166396","0.000000","142.250.75.132","192.168.68.121","HTTP2","746","DATA[3], DATA[3]","443","52421"
"261","3.166465","0.000069","192.168.68.121","142.250.75.132","TCP","54","52421  >  443 [ACK] Seq=4211 Ack=12614 Win=131584 Len=0","52421","443"
"262","3.168029","0.001564","142.250.75.132","192.168.68.121","TCP","60","443  >  52421 [ACK] Seq=12614 Ack=4211 Win=77824 Len=0","443","52421"
"263","3.170897","0.002868","142.250.75.132","192.168.68.121","TLSv1.3","1454","[TLS segment of a reassembled PDU]","443","52421"
"264","3.170897","0.000000","142.250.75.132","192.168.68.121","TLSv1.3","1094","[TLS segment of a reassembled PDU]","443","52421"
"265","3.170897","0.000000","142.250.75.132","192.168.68.121","TLSv1.3","1274","[TLS segment of a reassembled PDU]","443","52421"
"266","3.170897","0.000000","142.250.75.132","192.168.68.121","TLSv1.3","1274","[TLS segment of a reassembled PDU]","443","52421"
"267","3.171028","0.000131","192.168.68.121","142.250.75.132","TCP","54","52421  >  443 [ACK] Seq=4211 Ack=17494 Win=131584 Len=0","52421","443"
"268","3.172695","0.001667","142.250.75.132","192.168.68.121","TLSv1.3","1274","[TLS segment of a reassembled PDU]","443","52421"
"269","3.178365","0.005670","142.250.75.132","192.168.68.121","TLSv1.3","1274","[TLS segment of a reassembled PDU]","443","52421"
"270","3.178365","0.000000","142.250.75.132","192.168.68.121","TLSv1.3","1274","[TLS segment of a reassembled PDU]","443","52421"
"271","3.178458","0.000093","192.168.68.121","142.250.75.132","TCP","54","52421  >  443 [ACK] Seq=4211 Ack=21154 Win=131584 Len=0","52421","443"
"272","3.179746","0.001288","142.250.75.132","192.168.68.121","TLSv1.3","1274","[TLS segment of a reassembled PDU]","443","52421"
